/*
Navicat MySQL Data Transfer

Source Server         : localhost
Source Server Version : 100411
Source Host           : localhost:3306
Source Database       : absensi

Target Server Type    : MYSQL
Target Server Version : 100411
File Encoding         : 65001

Date: 2020-08-06 09:49:14
*/

SET FOREIGN_KEY_CHECKS=0;

-- ----------------------------
-- Table structure for api_log
-- ----------------------------
DROP TABLE IF EXISTS `api_log`;
CREATE TABLE `api_log` (
  `ApiAccessLogID` bigint(20) NOT NULL AUTO_INCREMENT,
  `SignatureKey` varchar(255) DEFAULT NULL,
  `IpClient` varchar(255) DEFAULT NULL,
  `IpClientForward` varchar(255) DEFAULT NULL,
  `UserAccessToken` varchar(255) DEFAULT NULL,
  `MethodRequest` varchar(255) DEFAULT NULL,
  `RequestParam` text DEFAULT NULL,
  `ResponseApi` text DEFAULT NULL,
  `ResponseStatus` text DEFAULT NULL,
  `CreatedDate` datetime DEFAULT NULL,
  `MissedParam` text DEFAULT NULL,
  PRIMARY KEY (`ApiAccessLogID`)
) ENGINE=InnoDB AUTO_INCREMENT=1402 DEFAULT CHARSET=latin1;

-- ----------------------------
-- Records of api_log
-- ----------------------------
INSERT INTO `api_log` VALUES ('1', 'dd7298aa1a5d2220ba3b11d82db4feb9a3bc908e', '10.5.50.14', '10.5.50.14', '0', 'loginMarketing', '{\"username\":\"marketing\",\"password\":\"123456\",\"signature\":\"dd7298aa1a5d2220ba3b11d82db4feb9a3bc908e\"}', '{\"greeting\":\"Welcome\",\"pic\":\"Rizal\",\"server_time\":\"21-08-2019 15:01:45\",\"status\":200,\"status_desc\":\"OK\",\"results\":{\"success\":\"fail\"}}', '200', '2019-08-21 15:01:45', '[]');
INSERT INTO `api_log` VALUES ('2', 'dd7298aa1a5d2220ba3b11d82db4feb9a3bc908e', '10.5.50.14', '10.5.50.14', '0', 'loginMarketing', '{\"username\":\"marketing\",\"password\":\"123456\",\"signature\":\"dd7298aa1a5d2220ba3b11d82db4feb9a3bc908e\"}', '{\"greeting\":\"Welcome\",\"pic\":\"Rizal\",\"server_time\":\"21-08-2019 15:03:06\",\"status\":200,\"status_desc\":\"OK\",\"results\":{\"success\":\"OK\",\"profile\":{\"nik\":\"1000001\",\"nama_lengkap\":\"marketing\",\"jnskel\":\"P\",\"nohp\":\"12345678901\",\"username\":\"marketing\",\"password\":\"e10adc3949ba59abbe56e057f20f883e\",\"id_jabatan\":\"3\"}}}', '200', '2019-08-21 15:03:06', '[]');
INSERT INTO `api_log` VALUES ('3', 'dd7298aa1a5d2220ba3b11d82db4feb9a3bc908e', '10.5.50.14', '10.5.50.14', '0', 'listTipeAktifitas', '{\"signature\":\"dd7298aa1a5d2220ba3b11d82db4feb9a3bc908e\"}', '{\"greeting\":\"Welcome\",\"pic\":\"Rizky M <rizky@kpptechnology.co.id>\",\"server_time\":\"21-08-2019 15:03:06\",\"status\":200,\"status_desc\":\"OK\",\"results\":[{\"id_tipe_aktifitas\":\"1\",\"nama_aktifitas\":\"Masuk Kantor\"},{\"id_tipe_aktifitas\":\"2\",\"nama_aktifitas\":\"Keluar Istirahat\"},{\"id_tipe_aktifitas\":\"3\",\"nama_aktifitas\":\"Masuk Istirahat\"},{\"id_tipe_aktifitas\":\"4\",\"nama_aktifitas\":\"Pulang Kantor\"}]}', '200', '2019-08-21 15:03:06', '[]');
INSERT INTO `api_log` VALUES ('4', 'dd7298aa1a5d2220ba3b11d82db4feb9a3bc908e', '180.214.232.67', '180.214.232.67', '0', 'loginMarketing', '{\"username\":\"marketing\",\"password\":\"13456\",\"signature\":\"dd7298aa1a5d2220ba3b11d82db4feb9a3bc908e\"}', '{\"greeting\":\"Welcome\",\"pic\":\"Rizal\",\"server_time\":\"21-08-2019 15:15:22\",\"status\":200,\"status_desc\":\"OK\",\"results\":{\"success\":\"fail\"}}', '200', '2019-08-21 15:15:22', '[]');
INSERT INTO `api_log` VALUES ('5', 'dd7298aa1a5d2220ba3b11d82db4feb9a3bc908e', '180.214.232.67', '180.214.232.67', '0', 'loginMarketing', '{\"username\":\"Marketing\",\"password\":\"13456\",\"signature\":\"dd7298aa1a5d2220ba3b11d82db4feb9a3bc908e\"}', '{\"greeting\":\"Welcome\",\"pic\":\"Rizal\",\"server_time\":\"21-08-2019 15:15:37\",\"status\":200,\"status_desc\":\"OK\",\"results\":{\"success\":\"fail\"}}', '200', '2019-08-21 15:15:37', '[]');
INSERT INTO `api_log` VALUES ('6', 'dd7298aa1a5d2220ba3b11d82db4feb9a3bc908e', '180.214.232.67', '180.214.232.67', '0', 'loginMarketing', '{\"username\":\"marketing\",\"password\":\"123456\",\"signature\":\"dd7298aa1a5d2220ba3b11d82db4feb9a3bc908e\"}', '{\"greeting\":\"Welcome\",\"pic\":\"Rizal\",\"server_time\":\"21-08-2019 15:16:25\",\"status\":200,\"status_desc\":\"OK\",\"results\":{\"success\":\"OK\",\"profile\":{\"nik\":\"1000001\",\"nama_lengkap\":\"marketing\",\"jnskel\":\"P\",\"nohp\":\"12345678901\",\"username\":\"marketing\",\"password\":\"e10adc3949ba59abbe56e057f20f883e\",\"id_jabatan\":\"3\"}}}', '200', '2019-08-21 15:16:25', '[]');
INSERT INTO `api_log` VALUES ('7', 'dd7298aa1a5d2220ba3b11d82db4feb9a3bc908e', '180.214.232.67', '180.214.232.67', '0', 'listTipeAktifitas', '{\"signature\":\"dd7298aa1a5d2220ba3b11d82db4feb9a3bc908e\"}', '{\"greeting\":\"Welcome\",\"pic\":\"Rizky M <rizky@kpptechnology.co.id>\",\"server_time\":\"21-08-2019 15:16:27\",\"status\":200,\"status_desc\":\"OK\",\"results\":[{\"id_tipe_aktifitas\":\"1\",\"nama_aktifitas\":\"Masuk Kantor\"},{\"id_tipe_aktifitas\":\"2\",\"nama_aktifitas\":\"Keluar Istirahat\"},{\"id_tipe_aktifitas\":\"3\",\"nama_aktifitas\":\"Masuk Istirahat\"},{\"id_tipe_aktifitas\":\"4\",\"nama_aktifitas\":\"Pulang Kantor\"}]}', '200', '2019-08-21 15:16:27', '[]');
INSERT INTO `api_log` VALUES ('8', 'dd7298aa1a5d2220ba3b11d82db4feb9a3bc908e', '116.206.28.8', '116.206.28.8', '0', 'loginMarketing', '{\"username\":\"Marketing\",\"password\":\"123456\",\"signature\":\"dd7298aa1a5d2220ba3b11d82db4feb9a3bc908e\"}', '{\"greeting\":\"Welcome\",\"pic\":\"Rizal\",\"server_time\":\"21-08-2019 15:16:55\",\"status\":200,\"status_desc\":\"OK\",\"results\":{\"success\":\"OK\",\"profile\":{\"nik\":\"1000001\",\"nama_lengkap\":\"marketing\",\"jnskel\":\"P\",\"nohp\":\"12345678901\",\"username\":\"marketing\",\"password\":\"e10adc3949ba59abbe56e057f20f883e\",\"id_jabatan\":\"3\"}}}', '200', '2019-08-21 15:16:55', '[]');
INSERT INTO `api_log` VALUES ('9', 'dd7298aa1a5d2220ba3b11d82db4feb9a3bc908e', '116.206.28.8', '116.206.28.8', '0', 'listTipeAktifitas', '{\"signature\":\"dd7298aa1a5d2220ba3b11d82db4feb9a3bc908e\"}', '{\"greeting\":\"Welcome\",\"pic\":\"Rizky M <rizky@kpptechnology.co.id>\",\"server_time\":\"21-08-2019 15:16:56\",\"status\":200,\"status_desc\":\"OK\",\"results\":[{\"id_tipe_aktifitas\":\"1\",\"nama_aktifitas\":\"Masuk Kantor\"},{\"id_tipe_aktifitas\":\"2\",\"nama_aktifitas\":\"Keluar Istirahat\"},{\"id_tipe_aktifitas\":\"3\",\"nama_aktifitas\":\"Masuk Istirahat\"},{\"id_tipe_aktifitas\":\"4\",\"nama_aktifitas\":\"Pulang Kantor\"}]}', '200', '2019-08-21 15:16:56', '[]');
INSERT INTO `api_log` VALUES ('10', 'dd7298aa1a5d2220ba3b11d82db4feb9a3bc908e', '116.206.28.8', '116.206.28.8', '0', 'logPosisi', '{\"id_tipe_aktifitas\":\"1\",\"nik\":\"1000001\",\"lat\":\"-6.1299967\",\"long\":\"106.6523336\",\"signature\":\"dd7298aa1a5d2220ba3b11d82db4feb9a3bc908e\"}', '{\"greeting\":\"Welcome\",\"pic\":\"Rizky Muhammad <rizky@kpptechnology.co.id>\",\"server_time\":\"21-08-2019 15:17:05\",\"status\":200,\"status_desc\":\"OK\",\"results\":[]}', '200', '2019-08-21 15:17:05', '[]');
INSERT INTO `api_log` VALUES ('11', 'dd7298aa1a5d2220ba3b11d82db4feb9a3bc908e', '180.214.232.67', '180.214.232.67', '0', 'listTipeAktifitas', '{\"signature\":\"dd7298aa1a5d2220ba3b11d82db4feb9a3bc908e\"}', '{\"greeting\":\"Welcome\",\"pic\":\"Rizky M <rizky@kpptechnology.co.id>\",\"server_time\":\"21-08-2019 15:17:06\",\"status\":200,\"status_desc\":\"OK\",\"results\":[{\"id_tipe_aktifitas\":\"1\",\"nama_aktifitas\":\"Masuk Kantor\"},{\"id_tipe_aktifitas\":\"2\",\"nama_aktifitas\":\"Keluar Istirahat\"},{\"id_tipe_aktifitas\":\"3\",\"nama_aktifitas\":\"Masuk Istirahat\"},{\"id_tipe_aktifitas\":\"4\",\"nama_aktifitas\":\"Pulang Kantor\"}]}', '200', '2019-08-21 15:17:06', '[]');
INSERT INTO `api_log` VALUES ('12', 'dd7298aa1a5d2220ba3b11d82db4feb9a3bc908e', '116.206.28.8', '116.206.28.8', '0', 'logPosisi', '{\"id_tipe_aktifitas\":\"2\",\"nik\":\"1000001\",\"lat\":\"-6.1299967\",\"long\":\"106.6523336\",\"signature\":\"dd7298aa1a5d2220ba3b11d82db4feb9a3bc908e\"}', '{\"greeting\":\"Welcome\",\"pic\":\"Rizky Muhammad <rizky@kpptechnology.co.id>\",\"server_time\":\"21-08-2019 15:17:12\",\"status\":200,\"status_desc\":\"OK\",\"results\":[]}', '200', '2019-08-21 15:17:12', '[]');
INSERT INTO `api_log` VALUES ('13', 'dd7298aa1a5d2220ba3b11d82db4feb9a3bc908e', '116.206.28.8', '116.206.28.8', '0', 'logPosisi', '{\"id_tipe_aktifitas\":\"4\",\"nik\":\"1000001\",\"lat\":\"-6.1299967\",\"long\":\"106.6523336\",\"signature\":\"dd7298aa1a5d2220ba3b11d82db4feb9a3bc908e\"}', '{\"greeting\":\"Welcome\",\"pic\":\"Rizky Muhammad <rizky@kpptechnology.co.id>\",\"server_time\":\"21-08-2019 15:17:18\",\"status\":200,\"status_desc\":\"OK\",\"results\":[]}', '200', '2019-08-21 15:17:18', '[]');
INSERT INTO `api_log` VALUES ('14', 'dd7298aa1a5d2220ba3b11d82db4feb9a3bc908e', '180.214.232.67', '180.214.232.67', '0', 'logPosisi', '{\"id_tipe_aktifitas\":\"1\",\"nik\":\"1000001\",\"lat\":\"-6.167752\",\"long\":\"106.6923219\",\"signature\":\"dd7298aa1a5d2220ba3b11d82db4feb9a3bc908e\"}', '{\"greeting\":\"Welcome\",\"pic\":\"Rizky Muhammad <rizky@kpptechnology.co.id>\",\"server_time\":\"21-08-2019 15:17:43\",\"status\":200,\"status_desc\":\"OK\",\"results\":[]}', '200', '2019-08-21 15:17:43', '[]');
INSERT INTO `api_log` VALUES ('15', 'dd7298aa1a5d2220ba3b11d82db4feb9a3bc908e', '180.214.232.67', '180.214.232.67', '0', 'Area', '{\"signature\":\"dd7298aa1a5d2220ba3b11d82db4feb9a3bc908e\"}', '{\"greeting\":\"Welcome\",\"pic\":\"Rizky M <rizky@kpptechnology.co.id>\",\"server_time\":\"21-08-2019 15:17:54\",\"status\":200,\"status_desc\":\"OK\",\"results\":[{\"id_area\":\"1\",\"nama_area\":\"Jakarta Barat\",\"latlong\":\"-7.953018874782471, 112.61549592018127\"},{\"id_area\":\"2\",\"nama_area\":\"Tangerang\",\"latlong\":\"-8.672908854737257, 115.22641240497865\"},{\"id_area\":\"3\",\"nama_area\":\"Jakarta Selatan\",\"latlong\":\"-8.656173924325643, 115.21700083094413\"},{\"id_area\":\"4\",\"nama_area\":\"Jakarta Pusat\",\"latlong\":\"-8.596439868394672, 115.22596068857945\"},{\"id_area\":\"5\",\"nama_area\":\"Jakarta Timur\",\"latlong\":\"-8.674240755149155, 115.20688510393757\"},{\"id_area\":\"6\",\"nama_area\":\"Jakarta Utara\",\"latlong\":\"\"}]}', '200', '2019-08-21 15:17:54', '[]');
INSERT INTO `api_log` VALUES ('16', 'dd7298aa1a5d2220ba3b11d82db4feb9a3bc908e', '180.214.232.67', '180.214.232.67', '0', 'listTipeAktifitas', '{\"signature\":\"dd7298aa1a5d2220ba3b11d82db4feb9a3bc908e\"}', '{\"greeting\":\"Welcome\",\"pic\":\"Rizky M <rizky@kpptechnology.co.id>\",\"server_time\":\"21-08-2019 15:21:08\",\"status\":200,\"status_desc\":\"OK\",\"results\":[{\"id_tipe_aktifitas\":\"1\",\"nama_aktifitas\":\"Masuk Kantor\"},{\"id_tipe_aktifitas\":\"2\",\"nama_aktifitas\":\"Keluar Istirahat\"},{\"id_tipe_aktifitas\":\"3\",\"nama_aktifitas\":\"Masuk Istirahat\"},{\"id_tipe_aktifitas\":\"4\",\"nama_aktifitas\":\"Pulang Kantor\"}]}', '200', '2019-08-21 15:21:08', '[]');
INSERT INTO `api_log` VALUES ('17', 'dd7298aa1a5d2220ba3b11d82db4feb9a3bc908e', '116.206.28.8', '116.206.28.8', '0', 'Area', '{\"signature\":\"dd7298aa1a5d2220ba3b11d82db4feb9a3bc908e\"}', '{\"greeting\":\"Welcome\",\"pic\":\"Rizky M <rizky@kpptechnology.co.id>\",\"server_time\":\"21-08-2019 15:21:19\",\"status\":200,\"status_desc\":\"OK\",\"results\":[{\"id_area\":\"1\",\"nama_area\":\"Jakarta Barat\",\"latlong\":\"-7.953018874782471, 112.61549592018127\"},{\"id_area\":\"2\",\"nama_area\":\"Tangerang\",\"latlong\":\"-8.672908854737257, 115.22641240497865\"},{\"id_area\":\"3\",\"nama_area\":\"Jakarta Selatan\",\"latlong\":\"-8.656173924325643, 115.21700083094413\"},{\"id_area\":\"4\",\"nama_area\":\"Jakarta Pusat\",\"latlong\":\"-8.596439868394672, 115.22596068857945\"},{\"id_area\":\"5\",\"nama_area\":\"Jakarta Timur\",\"latlong\":\"-8.674240755149155, 115.20688510393757\"},{\"id_area\":\"6\",\"nama_area\":\"Jakarta Utara\",\"latlong\":\"\"}]}', '200', '2019-08-21 15:21:19', '[]');
INSERT INTO `api_log` VALUES ('18', 'dd7298aa1a5d2220ba3b11d82db4feb9a3bc908e', '10.5.50.14', '10.5.50.14', '0', 'listTipeAktifitas', '{\"signature\":\"dd7298aa1a5d2220ba3b11d82db4feb9a3bc908e\"}', '{\"greeting\":\"Welcome\",\"pic\":\"Rizky M <rizky@kpptechnology.co.id>\",\"server_time\":\"21-08-2019 15:23:32\",\"status\":200,\"status_desc\":\"OK\",\"results\":[{\"id_tipe_aktifitas\":\"1\",\"nama_aktifitas\":\"Masuk Kantor\"},{\"id_tipe_aktifitas\":\"2\",\"nama_aktifitas\":\"Keluar Istirahat\"},{\"id_tipe_aktifitas\":\"3\",\"nama_aktifitas\":\"Masuk Istirahat\"},{\"id_tipe_aktifitas\":\"4\",\"nama_aktifitas\":\"Pulang Kantor\"}]}', '200', '2019-08-21 15:23:32', '[]');
INSERT INTO `api_log` VALUES ('19', 'dd7298aa1a5d2220ba3b11d82db4feb9a3bc908e', '10.5.50.14', '10.5.50.14', '0', 'Area', '{\"signature\":\"dd7298aa1a5d2220ba3b11d82db4feb9a3bc908e\"}', '{\"greeting\":\"Welcome\",\"pic\":\"Rizky M <rizky@kpptechnology.co.id>\",\"server_time\":\"21-08-2019 15:23:35\",\"status\":200,\"status_desc\":\"OK\",\"results\":[{\"id_area\":\"1\",\"nama_area\":\"Jakarta Barat\",\"latlong\":\"-7.953018874782471, 112.61549592018127\"},{\"id_area\":\"2\",\"nama_area\":\"Tangerang\",\"latlong\":\"-8.672908854737257, 115.22641240497865\"},{\"id_area\":\"3\",\"nama_area\":\"Jakarta Selatan\",\"latlong\":\"-8.656173924325643, 115.21700083094413\"},{\"id_area\":\"4\",\"nama_area\":\"Jakarta Pusat\",\"latlong\":\"-8.596439868394672, 115.22596068857945\"},{\"id_area\":\"5\",\"nama_area\":\"Jakarta Timur\",\"latlong\":\"-8.674240755149155, 115.20688510393757\"},{\"id_area\":\"6\",\"nama_area\":\"Jakarta Utara\",\"latlong\":\"\"}]}', '200', '2019-08-21 15:23:35', '[]');
INSERT INTO `api_log` VALUES ('20', 'dd7298aa1a5d2220ba3b11d82db4feb9a3bc908e', '10.5.50.14', '10.5.50.14', '0', 'listTipeAktifitas', '{\"signature\":\"dd7298aa1a5d2220ba3b11d82db4feb9a3bc908e\"}', '{\"greeting\":\"Welcome\",\"pic\":\"Rizky M <rizky@kpptechnology.co.id>\",\"server_time\":\"21-08-2019 15:23:46\",\"status\":200,\"status_desc\":\"OK\",\"results\":[{\"id_tipe_aktifitas\":\"1\",\"nama_aktifitas\":\"Masuk Kantor\"},{\"id_tipe_aktifitas\":\"2\",\"nama_aktifitas\":\"Keluar Istirahat\"},{\"id_tipe_aktifitas\":\"3\",\"nama_aktifitas\":\"Masuk Istirahat\"},{\"id_tipe_aktifitas\":\"4\",\"nama_aktifitas\":\"Pulang Kantor\"}]}', '200', '2019-08-21 15:23:46', '[]');
INSERT INTO `api_log` VALUES ('21', 'dd7298aa1a5d2220ba3b11d82db4feb9a3bc908e', '180.214.232.67', '180.214.232.67', '0', 'listTipeAktifitas', '{\"signature\":\"dd7298aa1a5d2220ba3b11d82db4feb9a3bc908e\"}', '{\"greeting\":\"Welcome\",\"pic\":\"Rizky M <rizky@kpptechnology.co.id>\",\"server_time\":\"21-08-2019 15:24:46\",\"status\":200,\"status_desc\":\"OK\",\"results\":[{\"id_tipe_aktifitas\":\"1\",\"nama_aktifitas\":\"Masuk Kantor\"},{\"id_tipe_aktifitas\":\"2\",\"nama_aktifitas\":\"Keluar Istirahat\"},{\"id_tipe_aktifitas\":\"3\",\"nama_aktifitas\":\"Masuk Istirahat\"},{\"id_tipe_aktifitas\":\"4\",\"nama_aktifitas\":\"Pulang Kantor\"}]}', '200', '2019-08-21 15:24:46', '[]');
INSERT INTO `api_log` VALUES ('22', 'dd7298aa1a5d2220ba3b11d82db4feb9a3bc908e', '180.214.232.67', '180.214.232.67', '0', 'Area', '{\"signature\":\"dd7298aa1a5d2220ba3b11d82db4feb9a3bc908e\"}', '{\"greeting\":\"Welcome\",\"pic\":\"Rizky M <rizky@kpptechnology.co.id>\",\"server_time\":\"21-08-2019 15:30:03\",\"status\":200,\"status_desc\":\"OK\",\"results\":[{\"id_area\":\"1\",\"nama_area\":\"Jakarta Barat\",\"latlong\":\"-7.953018874782471, 112.61549592018127\"},{\"id_area\":\"2\",\"nama_area\":\"Tangerang\",\"latlong\":\"-8.672908854737257, 115.22641240497865\"},{\"id_area\":\"3\",\"nama_area\":\"Jakarta Selatan\",\"latlong\":\"-8.656173924325643, 115.21700083094413\"},{\"id_area\":\"4\",\"nama_area\":\"Jakarta Pusat\",\"latlong\":\"-8.596439868394672, 115.22596068857945\"},{\"id_area\":\"5\",\"nama_area\":\"Jakarta Timur\",\"latlong\":\"-8.674240755149155, 115.20688510393757\"},{\"id_area\":\"6\",\"nama_area\":\"Jakarta Utara\",\"latlong\":\"\"}]}', '200', '2019-08-21 15:30:03', '[]');
INSERT INTO `api_log` VALUES ('23', 'dd7298aa1a5d2220ba3b11d82db4feb9a3bc908e', '180.214.232.67', '180.214.232.67', '0', 'listTipeAktifitas', '{\"signature\":\"dd7298aa1a5d2220ba3b11d82db4feb9a3bc908e\"}', '{\"greeting\":\"Welcome\",\"pic\":\"Rizky M <rizky@kpptechnology.co.id>\",\"server_time\":\"21-08-2019 15:30:10\",\"status\":200,\"status_desc\":\"OK\",\"results\":[{\"id_tipe_aktifitas\":\"1\",\"nama_aktifitas\":\"Masuk Kantor\"},{\"id_tipe_aktifitas\":\"2\",\"nama_aktifitas\":\"Keluar Istirahat\"},{\"id_tipe_aktifitas\":\"3\",\"nama_aktifitas\":\"Masuk Istirahat\"},{\"id_tipe_aktifitas\":\"4\",\"nama_aktifitas\":\"Pulang Kantor\"}]}', '200', '2019-08-21 15:30:10', '[]');
INSERT INTO `api_log` VALUES ('24', 'dd7298aa1a5d2220ba3b11d82db4feb9a3bc908e', '180.214.232.67', '180.214.232.67', '0', 'listTipeAktifitas', '{\"signature\":\"dd7298aa1a5d2220ba3b11d82db4feb9a3bc908e\"}', '{\"greeting\":\"Welcome\",\"pic\":\"Rizky M <rizky@kpptechnology.co.id>\",\"server_time\":\"21-08-2019 15:31:00\",\"status\":200,\"status_desc\":\"OK\",\"results\":[{\"id_tipe_aktifitas\":\"1\",\"nama_aktifitas\":\"Masuk Kantor\"},{\"id_tipe_aktifitas\":\"2\",\"nama_aktifitas\":\"Keluar Istirahat\"},{\"id_tipe_aktifitas\":\"3\",\"nama_aktifitas\":\"Masuk Istirahat\"},{\"id_tipe_aktifitas\":\"4\",\"nama_aktifitas\":\"Pulang Kantor\"}]}', '200', '2019-08-21 15:31:00', '[]');
INSERT INTO `api_log` VALUES ('25', 'dd7298aa1a5d2220ba3b11d82db4feb9a3bc908e', '180.214.232.67', '180.214.232.67', '0', 'Area', '{\"signature\":\"dd7298aa1a5d2220ba3b11d82db4feb9a3bc908e\"}', '{\"greeting\":\"Welcome\",\"pic\":\"Rizky M <rizky@kpptechnology.co.id>\",\"server_time\":\"21-08-2019 15:36:02\",\"status\":200,\"status_desc\":\"OK\",\"results\":[{\"id_area\":\"1\",\"nama_area\":\"Jakarta Barat\",\"latlong\":\"-7.953018874782471, 112.61549592018127\"},{\"id_area\":\"2\",\"nama_area\":\"Tangerang\",\"latlong\":\"-8.672908854737257, 115.22641240497865\"},{\"id_area\":\"3\",\"nama_area\":\"Jakarta Selatan\",\"latlong\":\"-8.656173924325643, 115.21700083094413\"},{\"id_area\":\"4\",\"nama_area\":\"Jakarta Pusat\",\"latlong\":\"-8.596439868394672, 115.22596068857945\"},{\"id_area\":\"5\",\"nama_area\":\"Jakarta Timur\",\"latlong\":\"-8.674240755149155, 115.20688510393757\"},{\"id_area\":\"6\",\"nama_area\":\"Jakarta Utara\",\"latlong\":\"\"}]}', '200', '2019-08-21 15:36:02', '[]');
INSERT INTO `api_log` VALUES ('26', 'dd7298aa1a5d2220ba3b11d82db4feb9a3bc908e', '10.5.50.14', '10.5.50.14', '0', 'logPosisi', '{\"id_tipe_aktifitas\":\"1\",\"nik\":\"1000001\",\"lat\":\"-6.4722914\",\"long\":\"106.8662258\",\"signature\":\"dd7298aa1a5d2220ba3b11d82db4feb9a3bc908e\"}', '{\"greeting\":\"Welcome\",\"pic\":\"Rizky Muhammad <rizky@kpptechnology.co.id>\",\"server_time\":\"21-08-2019 15:44:21\",\"status\":200,\"status_desc\":\"OK\",\"results\":[]}', '200', '2019-08-21 15:44:21', '[]');
INSERT INTO `api_log` VALUES ('27', 'dd7298aa1a5d2220ba3b11d82db4feb9a3bc908e', '10.5.50.14', '10.5.50.14', '0', 'logPosisi', '{\"id_tipe_aktifitas\":\"1\",\"nik\":\"1000001\",\"lat\":\"-6.4722914\",\"long\":\"106.8662258\",\"signature\":\"dd7298aa1a5d2220ba3b11d82db4feb9a3bc908e\"}', '{\"greeting\":\"Welcome\",\"pic\":\"Rizky Muhammad <rizky@kpptechnology.co.id>\",\"server_time\":\"21-08-2019 15:44:55\",\"status\":200,\"status_desc\":\"OK\",\"results\":[]}', '200', '2019-08-21 15:44:55', '[]');
INSERT INTO `api_log` VALUES ('28', 'dd7298aa1a5d2220ba3b11d82db4feb9a3bc908e', '10.5.50.14', '10.5.50.14', '0', 'listTipeAktifitas', '{\"signature\":\"dd7298aa1a5d2220ba3b11d82db4feb9a3bc908e\"}', '{\"greeting\":\"Welcome\",\"pic\":\"Rizky M <rizky@kpptechnology.co.id>\",\"server_time\":\"21-08-2019 16:31:28\",\"status\":200,\"status_desc\":\"OK\",\"results\":[{\"id_tipe_aktifitas\":\"1\",\"nama_aktifitas\":\"Masuk Kantor\"},{\"id_tipe_aktifitas\":\"2\",\"nama_aktifitas\":\"Keluar Istirahat\"},{\"id_tipe_aktifitas\":\"3\",\"nama_aktifitas\":\"Masuk Istirahat\"},{\"id_tipe_aktifitas\":\"4\",\"nama_aktifitas\":\"Pulang Kantor\"}]}', '200', '2019-08-21 16:31:28', '[]');
INSERT INTO `api_log` VALUES ('29', 'dd7298aa1a5d2220ba3b11d82db4feb9a3bc908e', '10.5.50.14', '10.5.50.14', '0', 'logPosisi', '{\"id_tipe_aktifitas\":\"2\",\"nik\":\"1000001\",\"lat\":\"-6.4722919\",\"long\":\"106.8662177\",\"signature\":\"dd7298aa1a5d2220ba3b11d82db4feb9a3bc908e\"}', '{\"greeting\":\"Welcome\",\"pic\":\"Rizky Muhammad <rizky@kpptechnology.co.id>\",\"server_time\":\"21-08-2019 16:31:33\",\"status\":200,\"status_desc\":\"OK\",\"results\":[]}', '200', '2019-08-21 16:31:33', '[]');
INSERT INTO `api_log` VALUES ('30', 'dd7298aa1a5d2220ba3b11d82db4feb9a3bc908e', '180.214.233.65', '180.214.233.65', '0', 'listTipeAktifitas', '{\"signature\":\"dd7298aa1a5d2220ba3b11d82db4feb9a3bc908e\"}', '{\"greeting\":\"Welcome\",\"pic\":\"Rizky M <rizky@kpptechnology.co.id>\",\"server_time\":\"21-08-2019 18:43:45\",\"status\":200,\"status_desc\":\"OK\",\"results\":[{\"id_tipe_aktifitas\":\"1\",\"nama_aktifitas\":\"Masuk Kantor\"},{\"id_tipe_aktifitas\":\"2\",\"nama_aktifitas\":\"Keluar Istirahat\"},{\"id_tipe_aktifitas\":\"3\",\"nama_aktifitas\":\"Masuk Istirahat\"},{\"id_tipe_aktifitas\":\"4\",\"nama_aktifitas\":\"Pulang Kantor\"}]}', '200', '2019-08-21 18:43:45', '[]');
INSERT INTO `api_log` VALUES ('31', 'dd7298aa1a5d2220ba3b11d82db4feb9a3bc908e', '180.214.233.65', '180.214.233.65', '0', 'listTipeAktifitas', '{\"signature\":\"dd7298aa1a5d2220ba3b11d82db4feb9a3bc908e\"}', '{\"greeting\":\"Welcome\",\"pic\":\"Rizky M <rizky@kpptechnology.co.id>\",\"server_time\":\"21-08-2019 18:44:40\",\"status\":200,\"status_desc\":\"OK\",\"results\":[{\"id_tipe_aktifitas\":\"1\",\"nama_aktifitas\":\"Masuk Kantor\"},{\"id_tipe_aktifitas\":\"2\",\"nama_aktifitas\":\"Keluar Istirahat\"},{\"id_tipe_aktifitas\":\"3\",\"nama_aktifitas\":\"Masuk Istirahat\"},{\"id_tipe_aktifitas\":\"4\",\"nama_aktifitas\":\"Pulang Kantor\"}]}', '200', '2019-08-21 18:44:40', '[]');
INSERT INTO `api_log` VALUES ('32', 'dd7298aa1a5d2220ba3b11d82db4feb9a3bc908e', '180.214.233.65', '180.214.233.65', '0', 'logPosisi', '{\"id_tipe_aktifitas\":\"1\",\"nik\":\"1000001\",\"lat\":\"-6.160659\",\"long\":\"106.694533\",\"signature\":\"dd7298aa1a5d2220ba3b11d82db4feb9a3bc908e\"}', '{\"greeting\":\"Welcome\",\"pic\":\"Rizky Muhammad <rizky@kpptechnology.co.id>\",\"server_time\":\"21-08-2019 18:44:51\",\"status\":200,\"status_desc\":\"OK\",\"results\":[]}', '200', '2019-08-21 18:44:51', '[]');
INSERT INTO `api_log` VALUES ('33', 'dd7298aa1a5d2220ba3b11d82db4feb9a3bc908e', '180.214.233.65', '180.214.233.65', '0', 'logPosisi', '{\"id_tipe_aktifitas\":\"4\",\"nik\":\"1000001\",\"lat\":\"-6.160659\",\"long\":\"106.694533\",\"signature\":\"dd7298aa1a5d2220ba3b11d82db4feb9a3bc908e\"}', '{\"greeting\":\"Welcome\",\"pic\":\"Rizky Muhammad <rizky@kpptechnology.co.id>\",\"server_time\":\"21-08-2019 18:45:22\",\"status\":200,\"status_desc\":\"OK\",\"results\":[]}', '200', '2019-08-21 18:45:22', '[]');
INSERT INTO `api_log` VALUES ('34', 'dd7298aa1a5d2220ba3b11d82db4feb9a3bc908e', '180.214.233.65', '180.214.233.65', '0', 'Area', '{\"signature\":\"dd7298aa1a5d2220ba3b11d82db4feb9a3bc908e\"}', '{\"greeting\":\"Welcome\",\"pic\":\"Rizky M <rizky@kpptechnology.co.id>\",\"server_time\":\"21-08-2019 18:45:29\",\"status\":200,\"status_desc\":\"OK\",\"results\":[{\"id_area\":\"1\",\"nama_area\":\"KPP\",\"latlong\":\"-6.472329096692758, 106.866033466266\"},{\"id_area\":\"2\",\"nama_area\":\"Tangerang\",\"latlong\":\"-8.672908854737257, 115.22641240497865\"},{\"id_area\":\"3\",\"nama_area\":\"Jakarta Selatan\",\"latlong\":\"-8.656173924325643, 115.21700083094413\"},{\"id_area\":\"4\",\"nama_area\":\"Jakarta Pusat\",\"latlong\":\"-8.596439868394672, 115.22596068857945\"},{\"id_area\":\"5\",\"nama_area\":\"Jakarta Timur\",\"latlong\":\"-8.674240755149155, 115.20688510393757\"},{\"id_area\":\"6\",\"nama_area\":\"Jakarta Utara\",\"latlong\":\"\"},{\"id_area\":\"8\",\"nama_area\":\"Jakarta Barat\",\"latlong\":\"-7.953018874782471, 112.61549592018127\"}]}', '200', '2019-08-21 18:45:29', '[]');
INSERT INTO `api_log` VALUES ('35', 'dd7298aa1a5d2220ba3b11d82db4feb9a3bc908e', '180.214.233.65', '180.214.233.65', '0', 'listTipeAktifitas', '{\"signature\":\"dd7298aa1a5d2220ba3b11d82db4feb9a3bc908e\"}', '{\"greeting\":\"Welcome\",\"pic\":\"Rizky M <rizky@kpptechnology.co.id>\",\"server_time\":\"21-08-2019 18:46:32\",\"status\":200,\"status_desc\":\"OK\",\"results\":[{\"id_tipe_aktifitas\":\"1\",\"nama_aktifitas\":\"Masuk Kantor\"},{\"id_tipe_aktifitas\":\"2\",\"nama_aktifitas\":\"Keluar Istirahat\"},{\"id_tipe_aktifitas\":\"3\",\"nama_aktifitas\":\"Masuk Istirahat\"},{\"id_tipe_aktifitas\":\"4\",\"nama_aktifitas\":\"Pulang Kantor\"}]}', '200', '2019-08-21 18:46:32', '[]');
INSERT INTO `api_log` VALUES ('36', 'dd7298aa1a5d2220ba3b11d82db4feb9a3bc908e', '180.214.233.65', '180.214.233.65', '0', 'loginMarketing', '{\"username\":\"admin\",\"password\":\"123456\",\"signature\":\"dd7298aa1a5d2220ba3b11d82db4feb9a3bc908e\"}', '{\"greeting\":\"Welcome\",\"pic\":\"Rizal\",\"server_time\":\"21-08-2019 18:46:49\",\"status\":200,\"status_desc\":\"OK\",\"results\":{\"success\":\"fail\"}}', '200', '2019-08-21 18:46:49', '[]');
INSERT INTO `api_log` VALUES ('37', 'dd7298aa1a5d2220ba3b11d82db4feb9a3bc908e', '180.214.233.65', '180.214.233.65', '0', 'loginMarketing', '{\"username\":\"marketing\",\"password\":\"123456\",\"signature\":\"dd7298aa1a5d2220ba3b11d82db4feb9a3bc908e\"}', '{\"greeting\":\"Welcome\",\"pic\":\"Rizal\",\"server_time\":\"21-08-2019 18:47:02\",\"status\":200,\"status_desc\":\"OK\",\"results\":{\"success\":\"OK\",\"profile\":{\"nik\":\"1000001\",\"nama_lengkap\":\"marketing\",\"jnskel\":\"P\",\"nohp\":\"12345678901\",\"username\":\"marketing\",\"password\":\"e10adc3949ba59abbe56e057f20f883e\",\"id_jabatan\":\"3\"}}}', '200', '2019-08-21 18:47:02', '[]');
INSERT INTO `api_log` VALUES ('38', 'dd7298aa1a5d2220ba3b11d82db4feb9a3bc908e', '180.214.233.65', '180.214.233.65', '0', 'listTipeAktifitas', '{\"signature\":\"dd7298aa1a5d2220ba3b11d82db4feb9a3bc908e\"}', '{\"greeting\":\"Welcome\",\"pic\":\"Rizky M <rizky@kpptechnology.co.id>\",\"server_time\":\"21-08-2019 18:47:08\",\"status\":200,\"status_desc\":\"OK\",\"results\":[{\"id_tipe_aktifitas\":\"1\",\"nama_aktifitas\":\"Masuk Kantor\"},{\"id_tipe_aktifitas\":\"2\",\"nama_aktifitas\":\"Keluar Istirahat\"},{\"id_tipe_aktifitas\":\"3\",\"nama_aktifitas\":\"Masuk Istirahat\"},{\"id_tipe_aktifitas\":\"4\",\"nama_aktifitas\":\"Pulang Kantor\"}]}', '200', '2019-08-21 18:47:08', '[]');
INSERT INTO `api_log` VALUES ('39', 'dd7298aa1a5d2220ba3b11d82db4feb9a3bc908e', '10.5.50.12', '10.5.50.12', '0', 'loginMarketing', '{\"username\":\"Marketing\",\"password\":\"123456\",\"signature\":\"dd7298aa1a5d2220ba3b11d82db4feb9a3bc908e\"}', '{\"greeting\":\"Welcome\",\"pic\":\"Rizal\",\"server_time\":\"22-08-2019 09:16:30\",\"status\":200,\"status_desc\":\"OK\",\"results\":{\"success\":\"OK\",\"profile\":{\"nik\":\"1000001\",\"nama_lengkap\":\"marketing\",\"jnskel\":\"P\",\"nohp\":\"12345678901\",\"username\":\"marketing\",\"password\":\"e10adc3949ba59abbe56e057f20f883e\",\"id_jabatan\":\"3\"}}}', '200', '2019-08-22 09:16:30', '[]');
INSERT INTO `api_log` VALUES ('40', 'dd7298aa1a5d2220ba3b11d82db4feb9a3bc908e', '10.5.50.12', '10.5.50.12', '0', 'listTipeAktifitas', '{\"signature\":\"dd7298aa1a5d2220ba3b11d82db4feb9a3bc908e\"}', '{\"greeting\":\"Welcome\",\"pic\":\"Rizky M <rizky@kpptechnology.co.id>\",\"server_time\":\"22-08-2019 09:16:30\",\"status\":200,\"status_desc\":\"OK\",\"results\":[{\"id_tipe_aktifitas\":\"1\",\"nama_aktifitas\":\"Masuk Kantor\"},{\"id_tipe_aktifitas\":\"2\",\"nama_aktifitas\":\"Keluar Istirahat\"},{\"id_tipe_aktifitas\":\"3\",\"nama_aktifitas\":\"Masuk Istirahat\"},{\"id_tipe_aktifitas\":\"4\",\"nama_aktifitas\":\"Pulang Kantor\"}]}', '200', '2019-08-22 09:16:30', '[]');
INSERT INTO `api_log` VALUES ('41', 'dd7298aa1a5d2220ba3b11d82db4feb9a3bc908e', '10.5.50.12', '10.5.50.12', '0', 'logPosisi', '{\"id_tipe_aktifitas\":\"1\",\"nik\":\"1000001\",\"lat\":\"-6.4722865\",\"long\":\"106.8662244\",\"signature\":\"dd7298aa1a5d2220ba3b11d82db4feb9a3bc908e\"}', '{\"greeting\":\"Welcome\",\"pic\":\"Rizky Muhammad <rizky@kpptechnology.co.id>\",\"server_time\":\"22-08-2019 09:16:48\",\"status\":200,\"status_desc\":\"OK\",\"results\":[]}', '200', '2019-08-22 09:16:48', '[]');
INSERT INTO `api_log` VALUES ('42', 'dd7298aa1a5d2220ba3b11d82db4feb9a3bc908e', '180.214.232.92', '180.214.232.92', '0', 'listTipeAktifitas', '{\"signature\":\"dd7298aa1a5d2220ba3b11d82db4feb9a3bc908e\"}', '{\"greeting\":\"Welcome\",\"pic\":\"Rizky M <rizky@kpptechnology.co.id>\",\"server_time\":\"22-08-2019 09:29:31\",\"status\":200,\"status_desc\":\"OK\",\"results\":[{\"id_tipe_aktifitas\":\"1\",\"nama_aktifitas\":\"Masuk Kantor\"},{\"id_tipe_aktifitas\":\"2\",\"nama_aktifitas\":\"Keluar Istirahat\"},{\"id_tipe_aktifitas\":\"3\",\"nama_aktifitas\":\"Masuk Istirahat\"},{\"id_tipe_aktifitas\":\"4\",\"nama_aktifitas\":\"Pulang Kantor\"}]}', '200', '2019-08-22 09:29:31', '[]');
INSERT INTO `api_log` VALUES ('43', 'dd7298aa1a5d2220ba3b11d82db4feb9a3bc908e', '180.214.232.92', '180.214.232.92', '0', 'loginMarketing', '{\"username\":\"marketing 1\",\"password\":\"1234567\",\"signature\":\"dd7298aa1a5d2220ba3b11d82db4feb9a3bc908e\"}', '{\"greeting\":\"Welcome\",\"pic\":\"Rizal\",\"server_time\":\"22-08-2019 09:31:01\",\"status\":200,\"status_desc\":\"OK\",\"results\":{\"success\":\"OK\",\"profile\":{\"nik\":\"008\",\"nama_lengkap\":\"Joko\",\"jnskel\":\"L\",\"nohp\":\"08967157\",\"username\":\"marketing 1\",\"password\":\"fcea920f7412b5da7be0cf42b8c93759\",\"id_jabatan\":\"3\"}}}', '200', '2019-08-22 09:31:01', '[]');
INSERT INTO `api_log` VALUES ('44', 'dd7298aa1a5d2220ba3b11d82db4feb9a3bc908e', '180.214.232.92', '180.214.232.92', '0', 'listTipeAktifitas', '{\"signature\":\"dd7298aa1a5d2220ba3b11d82db4feb9a3bc908e\"}', '{\"greeting\":\"Welcome\",\"pic\":\"Rizky M <rizky@kpptechnology.co.id>\",\"server_time\":\"22-08-2019 09:31:02\",\"status\":200,\"status_desc\":\"OK\",\"results\":[{\"id_tipe_aktifitas\":\"1\",\"nama_aktifitas\":\"Masuk Kantor\"},{\"id_tipe_aktifitas\":\"2\",\"nama_aktifitas\":\"Keluar Istirahat\"},{\"id_tipe_aktifitas\":\"3\",\"nama_aktifitas\":\"Masuk Istirahat\"},{\"id_tipe_aktifitas\":\"4\",\"nama_aktifitas\":\"Pulang Kantor\"}]}', '200', '2019-08-22 09:31:02', '[]');
INSERT INTO `api_log` VALUES ('45', 'dd7298aa1a5d2220ba3b11d82db4feb9a3bc908e', '180.214.232.92', '180.214.232.92', '0', 'logPosisi', '{\"id_tipe_aktifitas\":\"1\",\"nik\":\"008\",\"lat\":\"-6.1629519\",\"long\":\"106.7040597\",\"signature\":\"dd7298aa1a5d2220ba3b11d82db4feb9a3bc908e\"}', '{\"greeting\":\"Welcome\",\"pic\":\"Rizky Muhammad <rizky@kpptechnology.co.id>\",\"server_time\":\"22-08-2019 09:31:15\",\"status\":200,\"status_desc\":\"OK\",\"results\":[]}', '200', '2019-08-22 09:31:15', '[]');
INSERT INTO `api_log` VALUES ('46', 'dd7298aa1a5d2220ba3b11d82db4feb9a3bc908e', '180.214.232.92', '180.214.232.92', '0', 'logPosisi', '{\"id_tipe_aktifitas\":\"2\",\"nik\":\"008\",\"lat\":\"-6.1629519\",\"long\":\"106.7040597\",\"signature\":\"dd7298aa1a5d2220ba3b11d82db4feb9a3bc908e\"}', '{\"greeting\":\"Welcome\",\"pic\":\"Rizky Muhammad <rizky@kpptechnology.co.id>\",\"server_time\":\"22-08-2019 09:32:51\",\"status\":200,\"status_desc\":\"OK\",\"results\":[]}', '200', '2019-08-22 09:32:51', '[]');
INSERT INTO `api_log` VALUES ('47', 'dd7298aa1a5d2220ba3b11d82db4feb9a3bc908e', '180.214.232.92', '180.214.232.92', '0', 'Area', '{\"signature\":\"dd7298aa1a5d2220ba3b11d82db4feb9a3bc908e\"}', '{\"greeting\":\"Welcome\",\"pic\":\"Rizky M <rizky@kpptechnology.co.id>\",\"server_time\":\"22-08-2019 09:32:58\",\"status\":200,\"status_desc\":\"OK\",\"results\":[{\"id_area\":\"1\",\"nama_area\":\"KPP\",\"latlong\":\"-6.472329096692758, 106.866033466266\"},{\"id_area\":\"2\",\"nama_area\":\"Tangerang\",\"latlong\":\"-8.672908854737257, 115.22641240497865\"},{\"id_area\":\"3\",\"nama_area\":\"Jakarta Selatan\",\"latlong\":\"-8.656173924325643, 115.21700083094413\"},{\"id_area\":\"4\",\"nama_area\":\"Jakarta Pusat\",\"latlong\":\"-8.596439868394672, 115.22596068857945\"},{\"id_area\":\"5\",\"nama_area\":\"Jakarta Timur\",\"latlong\":\"-8.674240755149155, 115.20688510393757\"},{\"id_area\":\"6\",\"nama_area\":\"Jakarta Utara\",\"latlong\":\"\"},{\"id_area\":\"9\",\"nama_area\":\"Ocean park BSD City Serpong\",\"latlong\":\"-6.291797044484939, 106.66975568939336\"},{\"id_area\":\"8\",\"nama_area\":\"Jakarta Barat\",\"latlong\":\"-7.953018874782471, 112.61549592018127\"},{\"id_area\":\"10\",\"nama_area\":\"Tangerang\",\"latlong\":\"\"}]}', '200', '2019-08-22 09:32:58', '[]');
INSERT INTO `api_log` VALUES ('48', 'dd7298aa1a5d2220ba3b11d82db4feb9a3bc908e', '180.214.232.92', '180.214.232.92', '0', 'listTipeAktifitas', '{\"signature\":\"dd7298aa1a5d2220ba3b11d82db4feb9a3bc908e\"}', '{\"greeting\":\"Welcome\",\"pic\":\"Rizky M <rizky@kpptechnology.co.id>\",\"server_time\":\"22-08-2019 09:33:25\",\"status\":200,\"status_desc\":\"OK\",\"results\":[{\"id_tipe_aktifitas\":\"1\",\"nama_aktifitas\":\"Masuk Kantor\"},{\"id_tipe_aktifitas\":\"2\",\"nama_aktifitas\":\"Keluar Istirahat\"},{\"id_tipe_aktifitas\":\"3\",\"nama_aktifitas\":\"Masuk Istirahat\"},{\"id_tipe_aktifitas\":\"4\",\"nama_aktifitas\":\"Pulang Kantor\"}]}', '200', '2019-08-22 09:33:25', '[]');
INSERT INTO `api_log` VALUES ('49', 'dd7298aa1a5d2220ba3b11d82db4feb9a3bc908e', '223.255.225.228', '223.255.225.228', '0', 'listTipeAktifitas', '{\"signature\":\"dd7298aa1a5d2220ba3b11d82db4feb9a3bc908e\"}', '{\"greeting\":\"Welcome\",\"pic\":\"Rizky M <rizky@kpptechnology.co.id>\",\"server_time\":\"22-08-2019 10:27:30\",\"status\":200,\"status_desc\":\"OK\",\"results\":[{\"id_tipe_aktifitas\":\"1\",\"nama_aktifitas\":\"Masuk Kantor\"},{\"id_tipe_aktifitas\":\"2\",\"nama_aktifitas\":\"Keluar Istirahat\"},{\"id_tipe_aktifitas\":\"3\",\"nama_aktifitas\":\"Masuk Istirahat\"},{\"id_tipe_aktifitas\":\"4\",\"nama_aktifitas\":\"Pulang Kantor\"}]}', '200', '2019-08-22 10:27:30', '[]');
INSERT INTO `api_log` VALUES ('50', 'dd7298aa1a5d2220ba3b11d82db4feb9a3bc908e', '223.255.225.228', '223.255.225.228', '0', 'Area', '{\"signature\":\"dd7298aa1a5d2220ba3b11d82db4feb9a3bc908e\"}', '{\"greeting\":\"Welcome\",\"pic\":\"Rizky M <rizky@kpptechnology.co.id>\",\"server_time\":\"22-08-2019 10:27:36\",\"status\":200,\"status_desc\":\"OK\",\"results\":[{\"id_area\":\"1\",\"nama_area\":\"STMIK Nusa Mandiri, Kramat 18\",\"latlong\":\"-6.179933353841033, 106.84188217049768\"},{\"id_area\":\"2\",\"nama_area\":\"Tangerang\",\"latlong\":\"-8.672908854737257, 115.22641240497865\"},{\"id_area\":\"3\",\"nama_area\":\"Jakarta Selatan\",\"latlong\":\"-8.656173924325643, 115.21700083094413\"},{\"id_area\":\"4\",\"nama_area\":\"Jakarta Pusat\",\"latlong\":\"-8.596439868394672, 115.22596068857945\"},{\"id_area\":\"5\",\"nama_area\":\"Jakarta Timur\",\"latlong\":\"-8.674240755149155, 115.20688510393757\"},{\"id_area\":\"6\",\"nama_area\":\"Jakarta Utara\",\"latlong\":\"\"},{\"id_area\":\"9\",\"nama_area\":\"Ocean park BSD City Serpong\",\"latlong\":\"-6.291797044484939, 106.66975568939336\"},{\"id_area\":\"8\",\"nama_area\":\"Jakarta Barat\",\"latlong\":\"-7.953018874782471, 112.61549592018127\"}]}', '200', '2019-08-22 10:27:36', '[]');
INSERT INTO `api_log` VALUES ('51', 'dd7298aa1a5d2220ba3b11d82db4feb9a3bc908e', '223.255.225.228', '223.255.225.228', '0', 'listTipeAktifitas', '{\"signature\":\"dd7298aa1a5d2220ba3b11d82db4feb9a3bc908e\"}', '{\"greeting\":\"Welcome\",\"pic\":\"Rizky M <rizky@kpptechnology.co.id>\",\"server_time\":\"22-08-2019 10:28:21\",\"status\":200,\"status_desc\":\"OK\",\"results\":[{\"id_tipe_aktifitas\":\"1\",\"nama_aktifitas\":\"Masuk Kantor\"},{\"id_tipe_aktifitas\":\"2\",\"nama_aktifitas\":\"Keluar Istirahat\"},{\"id_tipe_aktifitas\":\"3\",\"nama_aktifitas\":\"Masuk Istirahat\"},{\"id_tipe_aktifitas\":\"4\",\"nama_aktifitas\":\"Pulang Kantor\"}]}', '200', '2019-08-22 10:28:21', '[]');
INSERT INTO `api_log` VALUES ('52', 'dd7298aa1a5d2220ba3b11d82db4feb9a3bc908e', '223.255.225.228', '223.255.225.228', '0', 'loginMarketing', '{\"username\":\"marketing\",\"password\":\"123456\",\"signature\":\"dd7298aa1a5d2220ba3b11d82db4feb9a3bc908e\"}', '{\"greeting\":\"Welcome\",\"pic\":\"Rizal\",\"server_time\":\"22-08-2019 10:29:54\",\"status\":200,\"status_desc\":\"OK\",\"results\":{\"success\":\"OK\",\"profile\":{\"nik\":\"1000001\",\"nama_lengkap\":\"marketing\",\"jnskel\":\"P\",\"nohp\":\"12345678901\",\"username\":\"marketing\",\"password\":\"e10adc3949ba59abbe56e057f20f883e\",\"id_jabatan\":\"3\"}}}', '200', '2019-08-22 10:29:54', '[]');
INSERT INTO `api_log` VALUES ('53', 'dd7298aa1a5d2220ba3b11d82db4feb9a3bc908e', '223.255.225.228', '223.255.225.228', '0', 'listTipeAktifitas', '{\"signature\":\"dd7298aa1a5d2220ba3b11d82db4feb9a3bc908e\"}', '{\"greeting\":\"Welcome\",\"pic\":\"Rizky M <rizky@kpptechnology.co.id>\",\"server_time\":\"22-08-2019 10:29:55\",\"status\":200,\"status_desc\":\"OK\",\"results\":[{\"id_tipe_aktifitas\":\"1\",\"nama_aktifitas\":\"Masuk Kantor\"},{\"id_tipe_aktifitas\":\"2\",\"nama_aktifitas\":\"Keluar Istirahat\"},{\"id_tipe_aktifitas\":\"3\",\"nama_aktifitas\":\"Masuk Istirahat\"},{\"id_tipe_aktifitas\":\"4\",\"nama_aktifitas\":\"Pulang Kantor\"}]}', '200', '2019-08-22 10:29:55', '[]');
INSERT INTO `api_log` VALUES ('54', 'dd7298aa1a5d2220ba3b11d82db4feb9a3bc908e', '223.255.225.228', '223.255.225.228', '0', 'logPosisi', '{\"id_tipe_aktifitas\":\"1\",\"nik\":\"1000001\",\"lat\":\"-6.1629519\",\"long\":\"106.7040597\",\"signature\":\"dd7298aa1a5d2220ba3b11d82db4feb9a3bc908e\"}', '{\"greeting\":\"Welcome\",\"pic\":\"Rizky Muhammad <rizky@kpptechnology.co.id>\",\"server_time\":\"22-08-2019 10:30:01\",\"status\":200,\"status_desc\":\"OK\",\"results\":[]}', '200', '2019-08-22 10:30:01', '[]');
INSERT INTO `api_log` VALUES ('55', 'dd7298aa1a5d2220ba3b11d82db4feb9a3bc908e', '223.255.225.228', '223.255.225.228', '0', 'listTipeAktifitas', '{\"signature\":\"dd7298aa1a5d2220ba3b11d82db4feb9a3bc908e\"}', '{\"greeting\":\"Welcome\",\"pic\":\"Rizky M <rizky@kpptechnology.co.id>\",\"server_time\":\"22-08-2019 13:59:43\",\"status\":200,\"status_desc\":\"OK\",\"results\":[{\"id_tipe_aktifitas\":\"1\",\"nama_aktifitas\":\"Masuk Kantor\"},{\"id_tipe_aktifitas\":\"2\",\"nama_aktifitas\":\"Keluar Istirahat\"},{\"id_tipe_aktifitas\":\"3\",\"nama_aktifitas\":\"Masuk Istirahat\"},{\"id_tipe_aktifitas\":\"4\",\"nama_aktifitas\":\"Pulang Kantor\"}]}', '200', '2019-08-22 13:59:43', '[]');
INSERT INTO `api_log` VALUES ('56', 'dd7298aa1a5d2220ba3b11d82db4feb9a3bc908e', '223.255.225.228', '223.255.225.228', '0', 'logPosisi', '{\"id_tipe_aktifitas\":\"1\",\"nik\":\"1000001\",\"lat\":\"-6.1792426\",\"long\":\"106.8408842\",\"signature\":\"dd7298aa1a5d2220ba3b11d82db4feb9a3bc908e\"}', '{\"greeting\":\"Welcome\",\"pic\":\"Rizky Muhammad <rizky@kpptechnology.co.id>\",\"server_time\":\"22-08-2019 14:00:06\",\"status\":200,\"status_desc\":\"OK\",\"results\":[]}', '200', '2019-08-22 14:00:06', '[]');
INSERT INTO `api_log` VALUES ('57', 'dd7298aa1a5d2220ba3b11d82db4feb9a3bc908e', '223.255.225.228', '223.255.225.228', '0', 'logPosisi', '{\"id_tipe_aktifitas\":\"4\",\"nik\":\"1000001\",\"lat\":\"-6.1792426\",\"long\":\"106.8408842\",\"signature\":\"dd7298aa1a5d2220ba3b11d82db4feb9a3bc908e\"}', '{\"greeting\":\"Welcome\",\"pic\":\"Rizky Muhammad <rizky@kpptechnology.co.id>\",\"server_time\":\"22-08-2019 14:01:37\",\"status\":200,\"status_desc\":\"OK\",\"results\":[]}', '200', '2019-08-22 14:01:37', '[]');
INSERT INTO `api_log` VALUES ('58', 'dd7298aa1a5d2220ba3b11d82db4feb9a3bc908e', '116.206.28.1', '116.206.28.1', '0', 'listTipeAktifitas', '{\"signature\":\"dd7298aa1a5d2220ba3b11d82db4feb9a3bc908e\"}', '{\"greeting\":\"Welcome\",\"pic\":\"Rizky M <rizky@kpptechnology.co.id>\",\"server_time\":\"23-08-2019 00:03:12\",\"status\":200,\"status_desc\":\"OK\",\"results\":[{\"id_tipe_aktifitas\":\"1\",\"nama_aktifitas\":\"Masuk Kantor\"},{\"id_tipe_aktifitas\":\"2\",\"nama_aktifitas\":\"Keluar Istirahat\"},{\"id_tipe_aktifitas\":\"3\",\"nama_aktifitas\":\"Masuk Istirahat\"},{\"id_tipe_aktifitas\":\"4\",\"nama_aktifitas\":\"Pulang Kantor\"}]}', '200', '2019-08-23 00:03:12', '[]');
INSERT INTO `api_log` VALUES ('59', 'dd7298aa1a5d2220ba3b11d82db4feb9a3bc908e', '116.206.28.1', '116.206.28.1', '0', 'logPosisi', '{\"id_tipe_aktifitas\":\"1\",\"nik\":\"1000001\",\"lat\":\"-6.1629056\",\"long\":\"106.7041148\",\"signature\":\"dd7298aa1a5d2220ba3b11d82db4feb9a3bc908e\"}', '{\"greeting\":\"Welcome\",\"pic\":\"Rizky Muhammad <rizky@kpptechnology.co.id>\",\"server_time\":\"23-08-2019 00:03:28\",\"status\":200,\"status_desc\":\"OK\",\"results\":[]}', '200', '2019-08-23 00:03:28', '[]');
INSERT INTO `api_log` VALUES ('60', 'dd7298aa1a5d2220ba3b11d82db4feb9a3bc908e', '116.206.28.1', '116.206.28.1', '0', 'logPosisi', '{\"id_tipe_aktifitas\":\"4\",\"nik\":\"1000001\",\"lat\":\"-6.1629056\",\"long\":\"106.7041148\",\"signature\":\"dd7298aa1a5d2220ba3b11d82db4feb9a3bc908e\"}', '{\"greeting\":\"Welcome\",\"pic\":\"Rizky Muhammad <rizky@kpptechnology.co.id>\",\"server_time\":\"23-08-2019 00:05:36\",\"status\":200,\"status_desc\":\"OK\",\"results\":[]}', '200', '2019-08-23 00:05:36', '[]');
INSERT INTO `api_log` VALUES ('61', 'dd7298aa1a5d2220ba3b11d82db4feb9a3bc908e', '116.206.28.1', '116.206.28.1', '0', 'loginMarketing', '{\"username\":\"marketing \",\"password\":\"123456\",\"signature\":\"dd7298aa1a5d2220ba3b11d82db4feb9a3bc908e\"}', '{\"greeting\":\"Welcome\",\"pic\":\"Rizal\",\"server_time\":\"23-08-2019 04:40:44\",\"status\":200,\"status_desc\":\"OK\",\"results\":{\"success\":\"OK\",\"profile\":{\"nik\":\"1000001\",\"nama_lengkap\":\"marketing\",\"jnskel\":\"P\",\"nohp\":\"12345678901\",\"username\":\"marketing\",\"password\":\"e10adc3949ba59abbe56e057f20f883e\",\"id_jabatan\":\"3\"}}}', '200', '2019-08-23 04:40:44', '[]');
INSERT INTO `api_log` VALUES ('62', 'dd7298aa1a5d2220ba3b11d82db4feb9a3bc908e', '116.206.28.1', '116.206.28.1', '0', 'listTipeAktifitas', '{\"signature\":\"dd7298aa1a5d2220ba3b11d82db4feb9a3bc908e\"}', '{\"greeting\":\"Welcome\",\"pic\":\"Rizky M <rizky@kpptechnology.co.id>\",\"server_time\":\"23-08-2019 04:40:45\",\"status\":200,\"status_desc\":\"OK\",\"results\":[{\"id_tipe_aktifitas\":\"1\",\"nama_aktifitas\":\"Masuk Kantor\"},{\"id_tipe_aktifitas\":\"2\",\"nama_aktifitas\":\"Keluar Istirahat\"},{\"id_tipe_aktifitas\":\"3\",\"nama_aktifitas\":\"Masuk Istirahat\"},{\"id_tipe_aktifitas\":\"4\",\"nama_aktifitas\":\"Pulang Kantor\"}]}', '200', '2019-08-23 04:40:45', '[]');
INSERT INTO `api_log` VALUES ('63', 'dd7298aa1a5d2220ba3b11d82db4feb9a3bc908e', '116.206.28.1', '116.206.28.1', '0', 'logPosisi', '{\"id_tipe_aktifitas\":\"1\",\"nik\":\"1000001\",\"lat\":\"-6.1629056\",\"long\":\"106.7041148\",\"signature\":\"dd7298aa1a5d2220ba3b11d82db4feb9a3bc908e\"}', '{\"greeting\":\"Welcome\",\"pic\":\"Rizky Muhammad <rizky@kpptechnology.co.id>\",\"server_time\":\"23-08-2019 04:40:54\",\"status\":200,\"status_desc\":\"OK\",\"results\":[]}', '200', '2019-08-23 04:40:54', '[]');
INSERT INTO `api_log` VALUES ('64', 'dd7298aa1a5d2220ba3b11d82db4feb9a3bc908e', '116.206.28.1', '116.206.28.1', '0', 'logPosisi', '{\"id_tipe_aktifitas\":\"4\",\"nik\":\"1000001\",\"lat\":\"-6.1629056\",\"long\":\"106.7041148\",\"signature\":\"dd7298aa1a5d2220ba3b11d82db4feb9a3bc908e\"}', '{\"greeting\":\"Welcome\",\"pic\":\"Rizky Muhammad <rizky@kpptechnology.co.id>\",\"server_time\":\"23-08-2019 04:42:21\",\"status\":200,\"status_desc\":\"OK\",\"results\":[]}', '200', '2019-08-23 04:42:21', '[]');
INSERT INTO `api_log` VALUES ('65', 'dd7298aa1a5d2220ba3b11d82db4feb9a3bc908e', '116.206.28.1', '116.206.28.1', '0', 'loginMarketing', '{\"username\":\"marketing 2\",\"password\":\"1234567\",\"signature\":\"dd7298aa1a5d2220ba3b11d82db4feb9a3bc908e\"}', '{\"greeting\":\"Welcome\",\"pic\":\"Rizal\",\"server_time\":\"23-08-2019 04:45:54\",\"status\":200,\"status_desc\":\"OK\",\"results\":{\"success\":\"fail\"}}', '200', '2019-08-23 04:45:54', '[]');
INSERT INTO `api_log` VALUES ('66', 'dd7298aa1a5d2220ba3b11d82db4feb9a3bc908e', '116.206.28.1', '116.206.28.1', '0', 'loginMarketing', '{\"username\":\"marketing 2\",\"password\":\"12345678\",\"signature\":\"dd7298aa1a5d2220ba3b11d82db4feb9a3bc908e\"}', '{\"greeting\":\"Welcome\",\"pic\":\"Rizal\",\"server_time\":\"23-08-2019 04:46:05\",\"status\":200,\"status_desc\":\"OK\",\"results\":{\"success\":\"OK\",\"profile\":{\"nik\":\"123456\",\"nama_lengkap\":\"Rati\",\"jnskel\":\"P\",\"nohp\":\"0812\",\"username\":\"marketing 2\",\"password\":\"25d55ad283aa400af464c76d713c07ad\",\"id_jabatan\":\"3\"}}}', '200', '2019-08-23 04:46:05', '[]');
INSERT INTO `api_log` VALUES ('67', 'dd7298aa1a5d2220ba3b11d82db4feb9a3bc908e', '116.206.28.1', '116.206.28.1', '0', 'listTipeAktifitas', '{\"signature\":\"dd7298aa1a5d2220ba3b11d82db4feb9a3bc908e\"}', '{\"greeting\":\"Welcome\",\"pic\":\"Rizky M <rizky@kpptechnology.co.id>\",\"server_time\":\"23-08-2019 04:46:05\",\"status\":200,\"status_desc\":\"OK\",\"results\":[{\"id_tipe_aktifitas\":\"1\",\"nama_aktifitas\":\"Masuk Kantor\"},{\"id_tipe_aktifitas\":\"2\",\"nama_aktifitas\":\"Keluar Istirahat\"},{\"id_tipe_aktifitas\":\"3\",\"nama_aktifitas\":\"Masuk Istirahat\"},{\"id_tipe_aktifitas\":\"4\",\"nama_aktifitas\":\"Pulang Kantor\"}]}', '200', '2019-08-23 04:46:05', '[]');
INSERT INTO `api_log` VALUES ('68', 'dd7298aa1a5d2220ba3b11d82db4feb9a3bc908e', '116.206.28.1', '116.206.28.1', '0', 'logPosisi', '{\"id_tipe_aktifitas\":\"1\",\"nik\":\"123456\",\"lat\":\"-6.1629056\",\"long\":\"106.7041148\",\"signature\":\"dd7298aa1a5d2220ba3b11d82db4feb9a3bc908e\"}', '{\"greeting\":\"Welcome\",\"pic\":\"Rizky Muhammad <rizky@kpptechnology.co.id>\",\"server_time\":\"23-08-2019 04:46:16\",\"status\":200,\"status_desc\":\"OK\",\"results\":[]}', '200', '2019-08-23 04:46:16', '[]');
INSERT INTO `api_log` VALUES ('69', 'dd7298aa1a5d2220ba3b11d82db4feb9a3bc908e', '116.206.28.1', '116.206.28.1', '0', 'logPosisi', '{\"id_tipe_aktifitas\":\"2\",\"nik\":\"123456\",\"lat\":\"-6.1629056\",\"long\":\"106.7041148\",\"signature\":\"dd7298aa1a5d2220ba3b11d82db4feb9a3bc908e\"}', '{\"greeting\":\"Welcome\",\"pic\":\"Rizky Muhammad <rizky@kpptechnology.co.id>\",\"server_time\":\"23-08-2019 04:49:33\",\"status\":200,\"status_desc\":\"OK\",\"results\":[]}', '200', '2019-08-23 04:49:33', '[]');
INSERT INTO `api_log` VALUES ('70', 'dd7298aa1a5d2220ba3b11d82db4feb9a3bc908e', '116.206.28.1', '116.206.28.1', '0', 'logPosisi', '{\"id_tipe_aktifitas\":\"3\",\"nik\":\"123456\",\"lat\":\"-6.1629056\",\"long\":\"106.7041148\",\"signature\":\"dd7298aa1a5d2220ba3b11d82db4feb9a3bc908e\"}', '{\"greeting\":\"Welcome\",\"pic\":\"Rizky Muhammad <rizky@kpptechnology.co.id>\",\"server_time\":\"23-08-2019 04:49:49\",\"status\":200,\"status_desc\":\"OK\",\"results\":[]}', '200', '2019-08-23 04:49:49', '[]');
INSERT INTO `api_log` VALUES ('71', 'dd7298aa1a5d2220ba3b11d82db4feb9a3bc908e', '116.206.28.1', '116.206.28.1', '0', 'logPosisi', '{\"id_tipe_aktifitas\":\"3\",\"nik\":\"123456\",\"lat\":\"-6.1629056\",\"long\":\"106.7041148\",\"signature\":\"dd7298aa1a5d2220ba3b11d82db4feb9a3bc908e\"}', '{\"greeting\":\"Welcome\",\"pic\":\"Rizky Muhammad <rizky@kpptechnology.co.id>\",\"server_time\":\"23-08-2019 04:50:06\",\"status\":200,\"status_desc\":\"OK\",\"results\":[]}', '200', '2019-08-23 04:50:06', '[]');
INSERT INTO `api_log` VALUES ('72', 'dd7298aa1a5d2220ba3b11d82db4feb9a3bc908e', '116.206.28.1', '116.206.28.1', '0', 'logPosisi', '{\"id_tipe_aktifitas\":\"4\",\"nik\":\"123456\",\"lat\":\"-6.1629056\",\"long\":\"106.7041148\",\"signature\":\"dd7298aa1a5d2220ba3b11d82db4feb9a3bc908e\"}', '{\"greeting\":\"Welcome\",\"pic\":\"Rizky Muhammad <rizky@kpptechnology.co.id>\",\"server_time\":\"23-08-2019 04:50:13\",\"status\":200,\"status_desc\":\"OK\",\"results\":[]}', '200', '2019-08-23 04:50:13', '[]');
INSERT INTO `api_log` VALUES ('73', 'dd7298aa1a5d2220ba3b11d82db4feb9a3bc908e', '116.206.28.19', '116.206.28.19', '0', 'listTipeAktifitas', '{\"signature\":\"dd7298aa1a5d2220ba3b11d82db4feb9a3bc908e\"}', '{\"greeting\":\"Welcome\",\"pic\":\"Rizky M <rizky@kpptechnology.co.id>\",\"server_time\":\"23-08-2019 13:20:35\",\"status\":200,\"status_desc\":\"OK\",\"results\":[{\"id_tipe_aktifitas\":\"1\",\"nama_aktifitas\":\"Masuk Kantor\"},{\"id_tipe_aktifitas\":\"2\",\"nama_aktifitas\":\"Keluar Istirahat\"},{\"id_tipe_aktifitas\":\"3\",\"nama_aktifitas\":\"Masuk Istirahat\"},{\"id_tipe_aktifitas\":\"4\",\"nama_aktifitas\":\"Pulang Kantor\"}]}', '200', '2019-08-23 13:20:35', '[]');
INSERT INTO `api_log` VALUES ('74', 'dd7298aa1a5d2220ba3b11d82db4feb9a3bc908e', '116.206.28.25', '116.206.28.25', '0', 'loginMarketing', '{\"username\":\"marketing1\",\"password\":\"123456\",\"signature\":\"dd7298aa1a5d2220ba3b11d82db4feb9a3bc908e\"}', '{\"greeting\":\"Welcome\",\"pic\":\"Rizal\",\"server_time\":\"05-09-2019 14:04:05\",\"status\":200,\"status_desc\":\"OK\",\"results\":{\"success\":\"fail\"}}', '200', '2019-09-05 14:04:05', '[]');
INSERT INTO `api_log` VALUES ('75', 'dd7298aa1a5d2220ba3b11d82db4feb9a3bc908e', '116.206.28.25', '116.206.28.25', '0', 'loginMarketing', '{\"username\":\"marketing\",\"password\":\"123456\",\"signature\":\"dd7298aa1a5d2220ba3b11d82db4feb9a3bc908e\"}', '{\"greeting\":\"Welcome\",\"pic\":\"Rizal\",\"server_time\":\"05-09-2019 14:04:47\",\"status\":200,\"status_desc\":\"OK\",\"results\":{\"success\":\"OK\",\"profile\":{\"nik\":\"1000001\",\"nama_lengkap\":\"marketing\",\"jnskel\":\"P\",\"nohp\":\"12345678901\",\"username\":\"marketing\",\"password\":\"e10adc3949ba59abbe56e057f20f883e\",\"id_jabatan\":\"3\"}}}', '200', '2019-09-05 14:04:47', '[]');
INSERT INTO `api_log` VALUES ('76', 'dd7298aa1a5d2220ba3b11d82db4feb9a3bc908e', '116.206.28.25', '116.206.28.25', '0', 'listTipeAktifitas', '{\"signature\":\"dd7298aa1a5d2220ba3b11d82db4feb9a3bc908e\"}', '{\"greeting\":\"Welcome\",\"pic\":\"Rizky M <rizky@kpptechnology.co.id>\",\"server_time\":\"05-09-2019 14:04:48\",\"status\":200,\"status_desc\":\"OK\",\"results\":[{\"id_tipe_aktifitas\":\"1\",\"nama_aktifitas\":\"Masuk Kantor\"},{\"id_tipe_aktifitas\":\"2\",\"nama_aktifitas\":\"Keluar Istirahat\"},{\"id_tipe_aktifitas\":\"3\",\"nama_aktifitas\":\"Masuk Istirahat\"},{\"id_tipe_aktifitas\":\"4\",\"nama_aktifitas\":\"Pulang Kantor\"}]}', '200', '2019-09-05 14:04:48', '[]');
INSERT INTO `api_log` VALUES ('77', 'dd7298aa1a5d2220ba3b11d82db4feb9a3bc908e', '116.206.28.25', '116.206.28.25', '0', 'logPosisi', '{\"id_tipe_aktifitas\":\"1\",\"nik\":\"1000001\",\"lat\":\"-6.149362\",\"long\":\"106.7284396\",\"signature\":\"dd7298aa1a5d2220ba3b11d82db4feb9a3bc908e\"}', '{\"greeting\":\"Welcome\",\"pic\":\"Rizky Muhammad <rizky@kpptechnology.co.id>\",\"server_time\":\"05-09-2019 14:05:41\",\"status\":200,\"status_desc\":\"OK\",\"results\":[]}', '200', '2019-09-05 14:05:41', '[]');
INSERT INTO `api_log` VALUES ('78', 'dd7298aa1a5d2220ba3b11d82db4feb9a3bc908e', '116.206.28.25', '116.206.28.25', '0', 'logPosisi', '{\"id_tipe_aktifitas\":\"1\",\"nik\":\"1000001\",\"lat\":\"-6.149362\",\"long\":\"106.7284396\",\"signature\":\"dd7298aa1a5d2220ba3b11d82db4feb9a3bc908e\"}', '{\"greeting\":\"Welcome\",\"pic\":\"Rizky Muhammad <rizky@kpptechnology.co.id>\",\"server_time\":\"05-09-2019 14:09:15\",\"status\":200,\"status_desc\":\"OK\",\"results\":[]}', '200', '2019-09-05 14:09:15', '[]');
INSERT INTO `api_log` VALUES ('79', 'dd7298aa1a5d2220ba3b11d82db4feb9a3bc908e', '116.206.28.25', '116.206.28.25', '0', 'logPosisi', '{\"id_tipe_aktifitas\":\"3\",\"nik\":\"1000001\",\"lat\":\"-6.149362\",\"long\":\"106.7284396\",\"signature\":\"dd7298aa1a5d2220ba3b11d82db4feb9a3bc908e\"}', '{\"greeting\":\"Welcome\",\"pic\":\"Rizky Muhammad <rizky@kpptechnology.co.id>\",\"server_time\":\"05-09-2019 14:09:30\",\"status\":200,\"status_desc\":\"OK\",\"results\":[]}', '200', '2019-09-05 14:09:30', '[]');
INSERT INTO `api_log` VALUES ('80', 'dd7298aa1a5d2220ba3b11d82db4feb9a3bc908e', '116.206.28.25', '116.206.28.25', '0', 'logPosisi', '{\"id_tipe_aktifitas\":\"4\",\"nik\":\"1000001\",\"lat\":\"-6.149362\",\"long\":\"106.7284396\",\"signature\":\"dd7298aa1a5d2220ba3b11d82db4feb9a3bc908e\"}', '{\"greeting\":\"Welcome\",\"pic\":\"Rizky Muhammad <rizky@kpptechnology.co.id>\",\"server_time\":\"05-09-2019 14:09:42\",\"status\":200,\"status_desc\":\"OK\",\"results\":[]}', '200', '2019-09-05 14:09:42', '[]');
INSERT INTO `api_log` VALUES ('81', 'dd7298aa1a5d2220ba3b11d82db4feb9a3bc908e', '10.5.50.12', '10.5.50.12', '0', 'loginMarketing', '{\"signature\":\"dd7298aa1a5d2220ba3b11d82db4feb9a3bc908e\",\"username\":\"reza\",\"password\":\"123456\"}', '{\"greeting\":\"Welcome\",\"pic\":\"Rizal\",\"server_time\":\"19-09-2019 11:37:42\",\"status\":200,\"status_desc\":\"OK\",\"results\":{\"success\":\"OK\",\"profile\":{\"nik\":\"1990\",\"nama_lengkap\":\"reza mahendra\",\"jnskel\":\"L\",\"nohp\":\"0819\",\"username\":\"reza\",\"password\":\"e10adc3949ba59abbe56e057f20f883e\",\"id_jabatan\":\"3\"}}}', '200', '2019-09-19 11:37:42', '[]');
INSERT INTO `api_log` VALUES ('82', 'dd7298aa1a5d2220ba3b11d82db4feb9a3bc908e', '10.5.50.12', '10.5.50.12', '0', 'Area', '{\"signature\":\"dd7298aa1a5d2220ba3b11d82db4feb9a3bc908e\"}', '{\"greeting\":\"Welcome\",\"pic\":\"Rizky M <rizky@kpptechnology.co.id>\",\"server_time\":\"19-09-2019 11:37:56\",\"status\":200,\"status_desc\":\"OK\",\"results\":[{\"id_area\":\"1\",\"nama_area\":\"STMIK Nusa Mandiri, Kramat 18\",\"latlong\":\"-6.179933353841033, 106.84188217049768\"},{\"id_area\":\"2\",\"nama_area\":\"Tangerang\",\"latlong\":\"-8.672908854737257, 115.22641240497865\"},{\"id_area\":\"3\",\"nama_area\":\"Jakarta Selatan\",\"latlong\":\"-8.656173924325643, 115.21700083094413\"},{\"id_area\":\"4\",\"nama_area\":\"Jakarta Pusat\",\"latlong\":\"-8.596439868394672, 115.22596068857945\"},{\"id_area\":\"5\",\"nama_area\":\"Jakarta Timur\",\"latlong\":\"-8.674240755149155, 115.20688510393757\"},{\"id_area\":\"6\",\"nama_area\":\"Jakarta Utara\",\"latlong\":\"-6.2846472024006985, 106.74525867290538\"},{\"id_area\":\"9\",\"nama_area\":\"Ocean park BSD City Serpong\",\"latlong\":\"-6.291797044484939, 106.66975568939336\"},{\"id_area\":\"8\",\"nama_area\":\"Jakarta Barat\",\"latlong\":\"-7.953018874782471, 112.61549592018127\"},{\"id_area\":\"11\",\"nama_area\":\"Puri Kembangan\",\"latlong\":\"-6.154640097330813, 106.75906760921498\"},{\"id_area\":\"13\",\"nama_area\":\"Tangerang\",\"latlong\":\"-6.1716662090844565, 106.61668377273338\"},{\"id_area\":\"14\",\"nama_area\":\"depok\",\"latlong\":\"-6.432416277116316, 106.80410099980463\"}]}', '200', '2019-09-19 11:37:56', '[]');
INSERT INTO `api_log` VALUES ('83', 'dd7298aa1a5d2220ba3b11d82db4feb9a3bc908e', '10.5.50.12', '10.5.50.12', '0', 'logPosisi', '{\"signature\":\"dd7298aa1a5d2220ba3b11d82db4feb9a3bc908e\",\"nik\":\"1990\",\"id_tipe_aktifitas\":\"1\",\"lat\":\"-7.953018874782471\",\"long\":\"112.61549592018127\"}', '{\"greeting\":\"Welcome\",\"pic\":\"Rizky Muhammad <rizky@kpptechnology.co.id>\",\"server_time\":\"19-09-2019 11:38:15\",\"status\":200,\"status_desc\":\"OK\",\"results\":[]}', '200', '2019-09-19 11:38:15', '[]');
INSERT INTO `api_log` VALUES ('84', 'dd7298aa1a5d2220ba3b11d82db4feb9a3bc908e', '10.5.50.16', '10.5.50.16', '0', 'Area', '{\"signature\":\"dd7298aa1a5d2220ba3b11d82db4feb9a3bc908e\"}', '{\"greeting\":\"Welcome\",\"pic\":\"Samuel\",\"server_time\":\"27-09-2019 14:50:24\",\"status\":200,\"status_desc\":\"OK\",\"results\":[{\"id_area\":\"1\",\"nama_area\":\"STMIK Nusa Mandiri, Kramat 18\",\"latlong\":\"-6.179933353841033, 106.84188217049768\"},{\"id_area\":\"2\",\"nama_area\":\"Tangerang\",\"latlong\":\"-8.672908854737257, 115.22641240497865\"},{\"id_area\":\"3\",\"nama_area\":\"Jakarta Selatan\",\"latlong\":\"-8.656173924325643, 115.21700083094413\"},{\"id_area\":\"4\",\"nama_area\":\"Jakarta Pusat\",\"latlong\":\"-8.596439868394672, 115.22596068857945\"},{\"id_area\":\"5\",\"nama_area\":\"Jakarta Timur\",\"latlong\":\"-8.674240755149155, 115.20688510393757\"},{\"id_area\":\"6\",\"nama_area\":\"Jakarta Utara\",\"latlong\":\"-6.2846472024006985, 106.74525867290538\"},{\"id_area\":\"9\",\"nama_area\":\"Ocean park BSD City Serpong\",\"latlong\":\"-6.291797044484939, 106.66975568939336\"},{\"id_area\":\"8\",\"nama_area\":\"Jakarta Barat\",\"latlong\":\"-7.953018874782471, 112.61549592018127\"},{\"id_area\":\"11\",\"nama_area\":\"Puri Kembangan\",\"latlong\":\"-6.154640097330813, 106.75906760921498\"},{\"id_area\":\"13\",\"nama_area\":\"Tangerang\",\"latlong\":\"-6.1716662090844565, 106.61668377273338\"},{\"id_area\":\"14\",\"nama_area\":\"depok\",\"latlong\":\"-6.432416277116316, 106.80410099980463\"}]}', '200', '2019-09-27 14:50:24', '[]');
INSERT INTO `api_log` VALUES ('85', 'dd7298aa1a5d2220ba3b11d82db4feb9a3bc908e', '10.5.50.16', '10.5.50.16', '0', 'listTipeAktifitas', '{\"signature\":\"dd7298aa1a5d2220ba3b11d82db4feb9a3bc908e\"}', '{\"greeting\":\"Welcome\",\"pic\":\"Samuel\",\"server_time\":\"27-09-2019 14:51:27\",\"status\":200,\"status_desc\":\"OK\",\"results\":[{\"id_tipe_aktifitas\":\"1\",\"nama_aktifitas\":\"Masuk Kantor\"},{\"id_tipe_aktifitas\":\"2\",\"nama_aktifitas\":\"Keluar Istirahat\"},{\"id_tipe_aktifitas\":\"3\",\"nama_aktifitas\":\"Masuk Istirahat\"},{\"id_tipe_aktifitas\":\"4\",\"nama_aktifitas\":\"Pulang Kantor\"}]}', '200', '2019-09-27 14:51:27', '[]');
INSERT INTO `api_log` VALUES ('86', 'dd7298aa1a5d2220ba3b11d82db4feb9a3bc908e', '10.5.50.16', '10.5.50.16', '0', 'loginMarketing', '{\"username\":\"marketing\",\"password\":\"123456\",\"signature\":\"dd7298aa1a5d2220ba3b11d82db4feb9a3bc908e\"}', '{\"greeting\":\"Welcome\",\"pic\":\"Samuel\",\"server_time\":\"27-09-2019 15:52:48\",\"status\":200,\"status_desc\":\"OK\",\"results\":{\"success\":\"OK\",\"profile\":{\"nik\":\"1000001\",\"nama_lengkap\":\"marketing\",\"jnskel\":\"P\",\"nohp\":\"12345678901\",\"username\":\"marketing\",\"password\":\"e10adc3949ba59abbe56e057f20f883e\",\"id_jabatan\":\"3\"}}}', '200', '2019-09-27 15:52:48', '[]');
INSERT INTO `api_log` VALUES ('87', 'dd7298aa1a5d2220ba3b11d82db4feb9a3bc908e', '10.5.50.16', '10.5.50.16', '0', 'loginMarketing', '{\"username\":\"marketing\",\"password\":\"123456\",\"signature\":\"dd7298aa1a5d2220ba3b11d82db4feb9a3bc908e\"}', '{\"greeting\":\"Welcome\",\"pic\":\"Samuel\",\"server_time\":\"27-09-2019 15:54:13\",\"status\":200,\"status_desc\":\"OK\",\"results\":{\"success\":\"OK\",\"profile\":{\"nik\":\"1000001\",\"nama_lengkap\":\"marketing\",\"jnskel\":\"P\",\"nohp\":\"12345678901\",\"username\":\"marketing\",\"password\":\"e10adc3949ba59abbe56e057f20f883e\",\"id_jabatan\":\"3\"}}}', '200', '2019-09-27 15:54:13', '[]');
INSERT INTO `api_log` VALUES ('88', 'dd7298aa1a5d2220ba3b11d82db4feb9a3bc908e', '10.5.50.16', '10.5.50.16', '0', 'loginMarketing', '{\"username\":\"marketing\",\"password\":\"123456\",\"signature\":\"dd7298aa1a5d2220ba3b11d82db4feb9a3bc908e\"}', '{\"greeting\":\"Welcome\",\"pic\":\"Samuel\",\"server_time\":\"27-09-2019 16:23:29\",\"status\":200,\"status_desc\":\"OK\",\"results\":{\"success\":\"OK\",\"profile\":{\"nik\":\"1000001\",\"nama_lengkap\":\"marketing\",\"jnskel\":\"P\",\"nohp\":\"12345678901\",\"username\":\"marketing\",\"password\":\"e10adc3949ba59abbe56e057f20f883e\",\"id_jabatan\":\"3\"}}}', '200', '2019-09-27 16:23:29', '[]');
INSERT INTO `api_log` VALUES ('89', 'dd7298aa1a5d2220ba3b11d82db4feb9a3bc908e', '10.5.50.16', '10.5.50.16', '0', 'Area', '{\"signature\":\"dd7298aa1a5d2220ba3b11d82db4feb9a3bc908e\"}', '{\"greeting\":\"Welcome\",\"pic\":\"Samuel\",\"server_time\":\"27-09-2019 16:39:54\",\"status\":200,\"status_desc\":\"OK\",\"results\":[{\"id_area\":\"1\",\"nama_area\":\"STMIK Nusa Mandiri, Kramat 18\",\"latlong\":\"-6.179933353841033, 106.84188217049768\"},{\"id_area\":\"2\",\"nama_area\":\"Tangerang\",\"latlong\":\"-8.672908854737257, 115.22641240497865\"},{\"id_area\":\"3\",\"nama_area\":\"Jakarta Selatan\",\"latlong\":\"-8.656173924325643, 115.21700083094413\"},{\"id_area\":\"4\",\"nama_area\":\"Jakarta Pusat\",\"latlong\":\"-8.596439868394672, 115.22596068857945\"},{\"id_area\":\"5\",\"nama_area\":\"Jakarta Timur\",\"latlong\":\"-8.674240755149155, 115.20688510393757\"},{\"id_area\":\"6\",\"nama_area\":\"Jakarta Utara\",\"latlong\":\"-6.2846472024006985, 106.74525867290538\"},{\"id_area\":\"9\",\"nama_area\":\"Ocean park BSD City Serpong\",\"latlong\":\"-6.291797044484939, 106.66975568939336\"},{\"id_area\":\"8\",\"nama_area\":\"Jakarta Barat\",\"latlong\":\"-7.953018874782471, 112.61549592018127\"},{\"id_area\":\"11\",\"nama_area\":\"Puri Kembangan\",\"latlong\":\"-6.154640097330813, 106.75906760921498\"},{\"id_area\":\"13\",\"nama_area\":\"Tangerang\",\"latlong\":\"-6.1716662090844565, 106.61668377273338\"},{\"id_area\":\"14\",\"nama_area\":\"depok\",\"latlong\":\"-6.432416277116316, 106.80410099980463\"}]}', '200', '2019-09-27 16:39:54', '[]');
INSERT INTO `api_log` VALUES ('90', 'dd7298aa1a5d2220ba3b11d82db4feb9a3bc908e', '10.5.50.16', '10.5.50.16', '0', 'Area', '{\"signature\":\"dd7298aa1a5d2220ba3b11d82db4feb9a3bc908e\"}', '{\"greeting\":\"Welcome\",\"pic\":\"Samuel\",\"server_time\":\"27-09-2019 16:46:05\",\"status\":200,\"status_desc\":\"OK\",\"results\":[{\"id_area\":\"1\",\"nama_area\":\"STMIK Nusa Mandiri, Kramat 18\",\"latlong\":\"-6.179933353841033, 106.84188217049768\"},{\"id_area\":\"2\",\"nama_area\":\"Tangerang\",\"latlong\":\"-8.672908854737257, 115.22641240497865\"},{\"id_area\":\"3\",\"nama_area\":\"Jakarta Selatan\",\"latlong\":\"-8.656173924325643, 115.21700083094413\"},{\"id_area\":\"4\",\"nama_area\":\"Jakarta Pusat\",\"latlong\":\"-8.596439868394672, 115.22596068857945\"},{\"id_area\":\"5\",\"nama_area\":\"Jakarta Timur\",\"latlong\":\"-8.674240755149155, 115.20688510393757\"},{\"id_area\":\"6\",\"nama_area\":\"Jakarta Utara\",\"latlong\":\"-6.2846472024006985, 106.74525867290538\"},{\"id_area\":\"9\",\"nama_area\":\"Ocean park BSD City Serpong\",\"latlong\":\"-6.291797044484939, 106.66975568939336\"},{\"id_area\":\"8\",\"nama_area\":\"Jakarta Barat\",\"latlong\":\"-7.953018874782471, 112.61549592018127\"},{\"id_area\":\"11\",\"nama_area\":\"Puri Kembangan\",\"latlong\":\"-6.154640097330813, 106.75906760921498\"},{\"id_area\":\"13\",\"nama_area\":\"Tangerang\",\"latlong\":\"-6.1716662090844565, 106.61668377273338\"},{\"id_area\":\"14\",\"nama_area\":\"depok\",\"latlong\":\"-6.432416277116316, 106.80410099980463\"}]}', '200', '2019-09-27 16:46:05', '[]');
INSERT INTO `api_log` VALUES ('91', 'dd7298aa1a5d2220ba3b11d82db4feb9a3bc908e', '10.5.50.16', '10.5.50.16', '0', 'Area', '{\"signature\":\"dd7298aa1a5d2220ba3b11d82db4feb9a3bc908e\"}', '{\"greeting\":\"Welcome\",\"pic\":\"Samuel\",\"server_time\":\"27-09-2019 16:51:42\",\"status\":200,\"status_desc\":\"OK\",\"results\":[{\"id_area\":\"1\",\"nama_area\":\"STMIK Nusa Mandiri, Kramat 18\",\"latlong\":\"-6.179933353841033, 106.84188217049768\"},{\"id_area\":\"2\",\"nama_area\":\"Tangerang\",\"latlong\":\"-8.672908854737257, 115.22641240497865\"},{\"id_area\":\"3\",\"nama_area\":\"Jakarta Selatan\",\"latlong\":\"-8.656173924325643, 115.21700083094413\"},{\"id_area\":\"4\",\"nama_area\":\"Jakarta Pusat\",\"latlong\":\"-8.596439868394672, 115.22596068857945\"},{\"id_area\":\"5\",\"nama_area\":\"Jakarta Timur\",\"latlong\":\"-8.674240755149155, 115.20688510393757\"},{\"id_area\":\"6\",\"nama_area\":\"Jakarta Utara\",\"latlong\":\"-6.2846472024006985, 106.74525867290538\"},{\"id_area\":\"9\",\"nama_area\":\"Ocean park BSD City Serpong\",\"latlong\":\"-6.291797044484939, 106.66975568939336\"},{\"id_area\":\"8\",\"nama_area\":\"Jakarta Barat\",\"latlong\":\"-7.953018874782471, 112.61549592018127\"},{\"id_area\":\"11\",\"nama_area\":\"Puri Kembangan\",\"latlong\":\"-6.154640097330813, 106.75906760921498\"},{\"id_area\":\"13\",\"nama_area\":\"Tangerang\",\"latlong\":\"-6.1716662090844565, 106.61668377273338\"},{\"id_area\":\"14\",\"nama_area\":\"depok\",\"latlong\":\"-6.432416277116316, 106.80410099980463\"}]}', '200', '2019-09-27 16:51:42', '[]');
INSERT INTO `api_log` VALUES ('92', 'dd7298aa1a5d2220ba3b11d82db4feb9a3bc908e', '10.5.50.16', '10.5.50.16', '0', 'Area', '{\"signature\":\"dd7298aa1a5d2220ba3b11d82db4feb9a3bc908e\"}', '{\"greeting\":\"Welcome\",\"pic\":\"Samuel\",\"server_time\":\"27-09-2019 16:55:32\",\"status\":200,\"status_desc\":\"OK\",\"results\":[{\"id_area\":\"1\",\"nama_area\":\"STMIK Nusa Mandiri, Kramat 18\",\"latlong\":\"-6.179933353841033, 106.84188217049768\"},{\"id_area\":\"2\",\"nama_area\":\"Tangerang\",\"latlong\":\"-8.672908854737257, 115.22641240497865\"},{\"id_area\":\"3\",\"nama_area\":\"Jakarta Selatan\",\"latlong\":\"-8.656173924325643, 115.21700083094413\"},{\"id_area\":\"4\",\"nama_area\":\"Jakarta Pusat\",\"latlong\":\"-8.596439868394672, 115.22596068857945\"},{\"id_area\":\"5\",\"nama_area\":\"Jakarta Timur\",\"latlong\":\"-8.674240755149155, 115.20688510393757\"},{\"id_area\":\"6\",\"nama_area\":\"Jakarta Utara\",\"latlong\":\"-6.2846472024006985, 106.74525867290538\"},{\"id_area\":\"9\",\"nama_area\":\"Ocean park BSD City Serpong\",\"latlong\":\"-6.291797044484939, 106.66975568939336\"},{\"id_area\":\"8\",\"nama_area\":\"Jakarta Barat\",\"latlong\":\"-7.953018874782471, 112.61549592018127\"},{\"id_area\":\"11\",\"nama_area\":\"Puri Kembangan\",\"latlong\":\"-6.154640097330813, 106.75906760921498\"},{\"id_area\":\"13\",\"nama_area\":\"Tangerang\",\"latlong\":\"-6.1716662090844565, 106.61668377273338\"},{\"id_area\":\"14\",\"nama_area\":\"depok\",\"latlong\":\"-6.432416277116316, 106.80410099980463\"}]}', '200', '2019-09-27 16:55:32', '[]');
INSERT INTO `api_log` VALUES ('93', 'dd7298aa1a5d2220ba3b11d82db4feb9a3bc908e', '10.5.50.16', '10.5.50.16', '0', 'Area', '{\"signature\":\"dd7298aa1a5d2220ba3b11d82db4feb9a3bc908e\"}', '{\"greeting\":\"Welcome\",\"pic\":\"Samuel\",\"server_time\":\"27-09-2019 16:56:26\",\"status\":200,\"status_desc\":\"OK\",\"results\":[{\"id_area\":\"1\",\"nama_area\":\"STMIK Nusa Mandiri, Kramat 18\",\"latlong\":\"-6.179933353841033, 106.84188217049768\"},{\"id_area\":\"2\",\"nama_area\":\"Tangerang\",\"latlong\":\"-8.672908854737257, 115.22641240497865\"},{\"id_area\":\"3\",\"nama_area\":\"Jakarta Selatan\",\"latlong\":\"-8.656173924325643, 115.21700083094413\"},{\"id_area\":\"4\",\"nama_area\":\"Jakarta Pusat\",\"latlong\":\"-8.596439868394672, 115.22596068857945\"},{\"id_area\":\"5\",\"nama_area\":\"Jakarta Timur\",\"latlong\":\"-8.674240755149155, 115.20688510393757\"},{\"id_area\":\"6\",\"nama_area\":\"Jakarta Utara\",\"latlong\":\"-6.2846472024006985, 106.74525867290538\"},{\"id_area\":\"9\",\"nama_area\":\"Ocean park BSD City Serpong\",\"latlong\":\"-6.291797044484939, 106.66975568939336\"},{\"id_area\":\"8\",\"nama_area\":\"Jakarta Barat\",\"latlong\":\"-7.953018874782471, 112.61549592018127\"},{\"id_area\":\"11\",\"nama_area\":\"Puri Kembangan\",\"latlong\":\"-6.154640097330813, 106.75906760921498\"},{\"id_area\":\"13\",\"nama_area\":\"Tangerang\",\"latlong\":\"-6.1716662090844565, 106.61668377273338\"},{\"id_area\":\"14\",\"nama_area\":\"depok\",\"latlong\":\"-6.432416277116316, 106.80410099980463\"}]}', '200', '2019-09-27 16:56:26', '[]');
INSERT INTO `api_log` VALUES ('94', 'dd7298aa1a5d2220ba3b11d82db4feb9a3bc908e', '10.5.50.16', '10.5.50.16', '0', 'listTipeAktifitas', '{\"signature\":\"dd7298aa1a5d2220ba3b11d82db4feb9a3bc908e\"}', '{\"greeting\":\"Welcome\",\"pic\":\"Samuel\",\"server_time\":\"27-09-2019 17:03:21\",\"status\":200,\"status_desc\":\"OK\",\"results\":[{\"id_tipe_aktifitas\":\"1\",\"nama_aktifitas\":\"Masuk Kantor\"},{\"id_tipe_aktifitas\":\"2\",\"nama_aktifitas\":\"Keluar Istirahat\"},{\"id_tipe_aktifitas\":\"3\",\"nama_aktifitas\":\"Masuk Istirahat\"},{\"id_tipe_aktifitas\":\"4\",\"nama_aktifitas\":\"Pulang Kantor\"}]}', '200', '2019-09-27 17:03:21', '[]');
INSERT INTO `api_log` VALUES ('95', 'dd7298aa1a5d2220ba3b11d82db4feb9a3bc908e', '10.5.50.16', '10.5.50.16', '0', 'Area', '{\"signature\":\"dd7298aa1a5d2220ba3b11d82db4feb9a3bc908e\"}', '{\"greeting\":\"Welcome\",\"pic\":\"Samuel\",\"server_time\":\"27-09-2019 17:04:27\",\"status\":200,\"status_desc\":\"OK\",\"results\":[{\"id_area\":\"1\",\"nama_area\":\"STMIK Nusa Mandiri, Kramat 18\",\"latlong\":\"-6.179933353841033, 106.84188217049768\"},{\"id_area\":\"2\",\"nama_area\":\"Tangerang\",\"latlong\":\"-8.672908854737257, 115.22641240497865\"},{\"id_area\":\"3\",\"nama_area\":\"Jakarta Selatan\",\"latlong\":\"-8.656173924325643, 115.21700083094413\"},{\"id_area\":\"4\",\"nama_area\":\"Jakarta Pusat\",\"latlong\":\"-8.596439868394672, 115.22596068857945\"},{\"id_area\":\"5\",\"nama_area\":\"Jakarta Timur\",\"latlong\":\"-8.674240755149155, 115.20688510393757\"},{\"id_area\":\"6\",\"nama_area\":\"Jakarta Utara\",\"latlong\":\"-6.2846472024006985, 106.74525867290538\"},{\"id_area\":\"9\",\"nama_area\":\"Ocean park BSD City Serpong\",\"latlong\":\"-6.291797044484939, 106.66975568939336\"},{\"id_area\":\"8\",\"nama_area\":\"Jakarta Barat\",\"latlong\":\"-7.953018874782471, 112.61549592018127\"},{\"id_area\":\"11\",\"nama_area\":\"Puri Kembangan\",\"latlong\":\"-6.154640097330813, 106.75906760921498\"},{\"id_area\":\"13\",\"nama_area\":\"Tangerang\",\"latlong\":\"-6.1716662090844565, 106.61668377273338\"},{\"id_area\":\"14\",\"nama_area\":\"depok\",\"latlong\":\"-6.432416277116316, 106.80410099980463\"}]}', '200', '2019-09-27 17:04:27', '[]');
INSERT INTO `api_log` VALUES ('96', 'dd7298aa1a5d2220ba3b11d82db4feb9a3bc908e', '10.5.50.16', '10.5.50.16', '0', 'listTipeAktifitas', '{\"signature\":\"dd7298aa1a5d2220ba3b11d82db4feb9a3bc908e\"}', '{\"greeting\":\"Welcome\",\"pic\":\"Samuel\",\"server_time\":\"27-09-2019 17:04:31\",\"status\":200,\"status_desc\":\"OK\",\"results\":[{\"id_tipe_aktifitas\":\"1\",\"nama_aktifitas\":\"Masuk Kantor\"},{\"id_tipe_aktifitas\":\"2\",\"nama_aktifitas\":\"Keluar Istirahat\"},{\"id_tipe_aktifitas\":\"3\",\"nama_aktifitas\":\"Masuk Istirahat\"},{\"id_tipe_aktifitas\":\"4\",\"nama_aktifitas\":\"Pulang Kantor\"}]}', '200', '2019-09-27 17:04:31', '[]');
INSERT INTO `api_log` VALUES ('97', 'dd7298aa1a5d2220ba3b11d82db4feb9a3bc908e', '10.5.50.16', '10.5.50.16', '0', 'listTipeAktifitas', '{\"signature\":\"dd7298aa1a5d2220ba3b11d82db4feb9a3bc908e\"}', '{\"greeting\":\"Welcome\",\"pic\":\"Samuel\",\"server_time\":\"27-09-2019 17:05:13\",\"status\":200,\"status_desc\":\"OK\",\"results\":[{\"id_tipe_aktifitas\":\"1\",\"nama_aktifitas\":\"Masuk Kantor\"},{\"id_tipe_aktifitas\":\"2\",\"nama_aktifitas\":\"Keluar Istirahat\"},{\"id_tipe_aktifitas\":\"3\",\"nama_aktifitas\":\"Masuk Istirahat\"},{\"id_tipe_aktifitas\":\"4\",\"nama_aktifitas\":\"Pulang Kantor\"}]}', '200', '2019-09-27 17:05:13', '[]');
INSERT INTO `api_log` VALUES ('98', 'dd7298aa1a5d2220ba3b11d82db4feb9a3bc908e', '10.5.50.16', '10.5.50.16', '0', 'Area', '{\"signature\":\"dd7298aa1a5d2220ba3b11d82db4feb9a3bc908e\"}', '{\"greeting\":\"Welcome\",\"pic\":\"Samuel\",\"server_time\":\"27-09-2019 17:05:13\",\"status\":200,\"status_desc\":\"OK\",\"results\":[{\"id_area\":\"1\",\"nama_area\":\"STMIK Nusa Mandiri, Kramat 18\",\"latlong\":\"-6.179933353841033, 106.84188217049768\"},{\"id_area\":\"2\",\"nama_area\":\"Tangerang\",\"latlong\":\"-8.672908854737257, 115.22641240497865\"},{\"id_area\":\"3\",\"nama_area\":\"Jakarta Selatan\",\"latlong\":\"-8.656173924325643, 115.21700083094413\"},{\"id_area\":\"4\",\"nama_area\":\"Jakarta Pusat\",\"latlong\":\"-8.596439868394672, 115.22596068857945\"},{\"id_area\":\"5\",\"nama_area\":\"Jakarta Timur\",\"latlong\":\"-8.674240755149155, 115.20688510393757\"},{\"id_area\":\"6\",\"nama_area\":\"Jakarta Utara\",\"latlong\":\"-6.2846472024006985, 106.74525867290538\"},{\"id_area\":\"9\",\"nama_area\":\"Ocean park BSD City Serpong\",\"latlong\":\"-6.291797044484939, 106.66975568939336\"},{\"id_area\":\"8\",\"nama_area\":\"Jakarta Barat\",\"latlong\":\"-7.953018874782471, 112.61549592018127\"},{\"id_area\":\"11\",\"nama_area\":\"Puri Kembangan\",\"latlong\":\"-6.154640097330813, 106.75906760921498\"},{\"id_area\":\"13\",\"nama_area\":\"Tangerang\",\"latlong\":\"-6.1716662090844565, 106.61668377273338\"},{\"id_area\":\"14\",\"nama_area\":\"depok\",\"latlong\":\"-6.432416277116316, 106.80410099980463\"}]}', '200', '2019-09-27 17:05:13', '[]');
INSERT INTO `api_log` VALUES ('99', 'dd7298aa1a5d2220ba3b11d82db4feb9a3bc908e', '10.5.50.16', '10.5.50.16', '0', 'listTipeAktifitas', '{\"signature\":\"dd7298aa1a5d2220ba3b11d82db4feb9a3bc908e\"}', '{\"greeting\":\"Welcome\",\"pic\":\"Samuel\",\"server_time\":\"27-09-2019 17:06:18\",\"status\":200,\"status_desc\":\"OK\",\"results\":[{\"id_tipe_aktifitas\":\"1\",\"nama_aktifitas\":\"Masuk Kantor\"},{\"id_tipe_aktifitas\":\"2\",\"nama_aktifitas\":\"Keluar Istirahat\"},{\"id_tipe_aktifitas\":\"3\",\"nama_aktifitas\":\"Masuk Istirahat\"},{\"id_tipe_aktifitas\":\"4\",\"nama_aktifitas\":\"Pulang Kantor\"}]}', '200', '2019-09-27 17:06:18', '[]');
INSERT INTO `api_log` VALUES ('100', 'dd7298aa1a5d2220ba3b11d82db4feb9a3bc908e', '10.5.50.16', '10.5.50.16', '0', 'listTipeAktifitas', '{\"signature\":\"dd7298aa1a5d2220ba3b11d82db4feb9a3bc908e\"}', '{\"greeting\":\"Welcome\",\"pic\":\"Samuel\",\"server_time\":\"27-09-2019 17:06:32\",\"status\":200,\"status_desc\":\"OK\",\"results\":[{\"id_tipe_aktifitas\":\"1\",\"nama_aktifitas\":\"Masuk Kantor\"},{\"id_tipe_aktifitas\":\"2\",\"nama_aktifitas\":\"Keluar Istirahat\"},{\"id_tipe_aktifitas\":\"3\",\"nama_aktifitas\":\"Masuk Istirahat\"},{\"id_tipe_aktifitas\":\"4\",\"nama_aktifitas\":\"Pulang Kantor\"}]}', '200', '2019-09-27 17:06:32', '[]');
INSERT INTO `api_log` VALUES ('101', 'dd7298aa1a5d2220ba3b11d82db4feb9a3bc908e', '10.5.50.16', '10.5.50.16', '0', 'listTipeAktifitas', '{\"signature\":\"dd7298aa1a5d2220ba3b11d82db4feb9a3bc908e\"}', '{\"greeting\":\"Welcome\",\"pic\":\"Samuel\",\"server_time\":\"27-09-2019 17:10:11\",\"status\":200,\"status_desc\":\"OK\",\"results\":[{\"id_tipe_aktifitas\":\"1\",\"nama_aktifitas\":\"Masuk Kantor\"},{\"id_tipe_aktifitas\":\"2\",\"nama_aktifitas\":\"Keluar Istirahat\"},{\"id_tipe_aktifitas\":\"3\",\"nama_aktifitas\":\"Masuk Istirahat\"},{\"id_tipe_aktifitas\":\"4\",\"nama_aktifitas\":\"Pulang Kantor\"}]}', '200', '2019-09-27 17:10:11', '[]');
INSERT INTO `api_log` VALUES ('102', 'dd7298aa1a5d2220ba3b11d82db4feb9a3bc908e', '10.5.50.16', '10.5.50.16', '0', 'listTipeAktifitas', '{\"nik\":\"1000001\",\"id_tipe_aktifitas\":\"2\",\"lat\":\"-6.4723394999999995\",\"long\":\"106.8661577\",\"signature\":\"dd7298aa1a5d2220ba3b11d82db4feb9a3bc908e\"}', '{\"greeting\":\"Welcome\",\"pic\":\"Samuel\",\"server_time\":\"27-09-2019 17:10:22\",\"status\":200,\"status_desc\":\"OK\",\"results\":[{\"id_tipe_aktifitas\":\"1\",\"nama_aktifitas\":\"Masuk Kantor\"},{\"id_tipe_aktifitas\":\"2\",\"nama_aktifitas\":\"Keluar Istirahat\"},{\"id_tipe_aktifitas\":\"3\",\"nama_aktifitas\":\"Masuk Istirahat\"},{\"id_tipe_aktifitas\":\"4\",\"nama_aktifitas\":\"Pulang Kantor\"}]}', '200', '2019-09-27 17:10:22', '[]');
INSERT INTO `api_log` VALUES ('103', 'dd7298aa1a5d2220ba3b11d82db4feb9a3bc908e', '10.5.50.16', '10.5.50.16', '0', 'listTipeAktifitas', '{\"signature\":\"dd7298aa1a5d2220ba3b11d82db4feb9a3bc908e\"}', '{\"greeting\":\"Welcome\",\"pic\":\"Samuel\",\"server_time\":\"27-09-2019 17:10:44\",\"status\":200,\"status_desc\":\"OK\",\"results\":[{\"id_tipe_aktifitas\":\"1\",\"nama_aktifitas\":\"Masuk Kantor\"},{\"id_tipe_aktifitas\":\"2\",\"nama_aktifitas\":\"Keluar Istirahat\"},{\"id_tipe_aktifitas\":\"3\",\"nama_aktifitas\":\"Masuk Istirahat\"},{\"id_tipe_aktifitas\":\"4\",\"nama_aktifitas\":\"Pulang Kantor\"}]}', '200', '2019-09-27 17:10:44', '[]');
INSERT INTO `api_log` VALUES ('104', 'dd7298aa1a5d2220ba3b11d82db4feb9a3bc908e', '10.5.50.16', '10.5.50.16', '0', 'logPosisi', '{\"nik\":\"1000001\",\"id_tipe_aktifitas\":\"3\",\"lat\":\"-6.4723394999999995\",\"long\":\"106.8661577\",\"signature\":\"dd7298aa1a5d2220ba3b11d82db4feb9a3bc908e\"}', '{\"greeting\":\"Welcome\",\"pic\":\"Samuel\",\"server_time\":\"27-09-2019 17:10:54\",\"status\":200,\"status_desc\":\"OK\",\"results\":[]}', '200', '2019-09-27 17:10:54', '[]');
INSERT INTO `api_log` VALUES ('105', 'dd7298aa1a5d2220ba3b11d82db4feb9a3bc908e', '10.5.50.16', '10.5.50.16', '0', 'listTipeAktifitas', '{\"signature\":\"dd7298aa1a5d2220ba3b11d82db4feb9a3bc908e\"}', '{\"greeting\":\"Welcome\",\"pic\":\"Samuel\",\"server_time\":\"27-09-2019 17:13:35\",\"status\":200,\"status_desc\":\"OK\",\"results\":[{\"id_tipe_aktifitas\":\"1\",\"nama_aktifitas\":\"Masuk Kantor\"},{\"id_tipe_aktifitas\":\"2\",\"nama_aktifitas\":\"Keluar Istirahat\"},{\"id_tipe_aktifitas\":\"3\",\"nama_aktifitas\":\"Masuk Istirahat\"},{\"id_tipe_aktifitas\":\"4\",\"nama_aktifitas\":\"Pulang Kantor\"}]}', '200', '2019-09-27 17:13:35', '[]');
INSERT INTO `api_log` VALUES ('106', 'dd7298aa1a5d2220ba3b11d82db4feb9a3bc908e', '182.0.199.87', '182.0.199.87', '0', 'listTipeAktifitas', '{\"signature\":\"dd7298aa1a5d2220ba3b11d82db4feb9a3bc908e\"}', '{\"greeting\":\"Welcome\",\"pic\":\"Samuel\",\"server_time\":\"27-09-2019 17:21:01\",\"status\":200,\"status_desc\":\"OK\",\"results\":[{\"id_tipe_aktifitas\":\"1\",\"nama_aktifitas\":\"Masuk Kantor\"},{\"id_tipe_aktifitas\":\"2\",\"nama_aktifitas\":\"Keluar Istirahat\"},{\"id_tipe_aktifitas\":\"3\",\"nama_aktifitas\":\"Masuk Istirahat\"},{\"id_tipe_aktifitas\":\"4\",\"nama_aktifitas\":\"Pulang Kantor\"}]}', '200', '2019-09-27 17:21:01', '[]');
INSERT INTO `api_log` VALUES ('107', 'dd7298aa1a5d2220ba3b11d82db4feb9a3bc908e', '182.0.199.87', '182.0.199.87', '0', 'loginMarketing', '{\"username\":\"marketing\",\"password\":\"123456\",\"signature\":\"dd7298aa1a5d2220ba3b11d82db4feb9a3bc908e\"}', '{\"greeting\":\"Welcome\",\"pic\":\"Samuel\",\"server_time\":\"27-09-2019 17:21:13\",\"status\":200,\"status_desc\":\"OK\",\"results\":{\"success\":\"OK\",\"profile\":{\"nik\":\"1000001\",\"nama_lengkap\":\"marketing\",\"jnskel\":\"P\",\"nohp\":\"12345678901\",\"username\":\"marketing\",\"password\":\"e10adc3949ba59abbe56e057f20f883e\",\"id_jabatan\":\"3\"}}}', '200', '2019-09-27 17:21:13', '[]');
INSERT INTO `api_log` VALUES ('108', 'dd7298aa1a5d2220ba3b11d82db4feb9a3bc908e', '182.0.199.87', '182.0.199.87', '0', 'Area', '{\"signature\":\"dd7298aa1a5d2220ba3b11d82db4feb9a3bc908e\"}', '{\"greeting\":\"Welcome\",\"pic\":\"Samuel\",\"server_time\":\"27-09-2019 17:21:17\",\"status\":200,\"status_desc\":\"OK\",\"results\":[{\"id_area\":\"1\",\"nama_area\":\"STMIK Nusa Mandiri, Kramat 18\",\"latlong\":\"-6.179933353841033, 106.84188217049768\"},{\"id_area\":\"2\",\"nama_area\":\"Tangerang\",\"latlong\":\"-8.672908854737257, 115.22641240497865\"},{\"id_area\":\"3\",\"nama_area\":\"Jakarta Selatan\",\"latlong\":\"-8.656173924325643, 115.21700083094413\"},{\"id_area\":\"4\",\"nama_area\":\"Jakarta Pusat\",\"latlong\":\"-8.596439868394672, 115.22596068857945\"},{\"id_area\":\"5\",\"nama_area\":\"Jakarta Timur\",\"latlong\":\"-8.674240755149155, 115.20688510393757\"},{\"id_area\":\"6\",\"nama_area\":\"Jakarta Utara\",\"latlong\":\"-6.2846472024006985, 106.74525867290538\"},{\"id_area\":\"9\",\"nama_area\":\"Ocean park BSD City Serpong\",\"latlong\":\"-6.291797044484939, 106.66975568939336\"},{\"id_area\":\"8\",\"nama_area\":\"Jakarta Barat\",\"latlong\":\"-7.953018874782471, 112.61549592018127\"},{\"id_area\":\"11\",\"nama_area\":\"Puri Kembangan\",\"latlong\":\"-6.154640097330813, 106.75906760921498\"},{\"id_area\":\"13\",\"nama_area\":\"Tangerang\",\"latlong\":\"-6.1716662090844565, 106.61668377273338\"},{\"id_area\":\"14\",\"nama_area\":\"depok\",\"latlong\":\"-6.432416277116316, 106.80410099980463\"}]}', '200', '2019-09-27 17:21:17', '[]');
INSERT INTO `api_log` VALUES ('109', 'dd7298aa1a5d2220ba3b11d82db4feb9a3bc908e', '182.0.199.14', '182.0.199.14', '0', 'listTipeAktifitas', '{\"signature\":\"dd7298aa1a5d2220ba3b11d82db4feb9a3bc908e\"}', '{\"greeting\":\"Welcome\",\"pic\":\"Samuel\",\"server_time\":\"27-09-2019 17:33:58\",\"status\":200,\"status_desc\":\"OK\",\"results\":[{\"id_tipe_aktifitas\":\"1\",\"nama_aktifitas\":\"Masuk Kantor\"},{\"id_tipe_aktifitas\":\"2\",\"nama_aktifitas\":\"Keluar Istirahat\"},{\"id_tipe_aktifitas\":\"3\",\"nama_aktifitas\":\"Masuk Istirahat\"},{\"id_tipe_aktifitas\":\"4\",\"nama_aktifitas\":\"Pulang Kantor\"}]}', '200', '2019-09-27 17:33:58', '[]');
INSERT INTO `api_log` VALUES ('110', 'dd7298aa1a5d2220ba3b11d82db4feb9a3bc908e', '182.0.199.14', '182.0.199.14', '0', 'logPosisi', '{\"nik\":\"1000001\",\"id_tipe_aktifitas\":\"2\",\"lat\":\"-6.4722832\",\"long\":\"106.86621\",\"signature\":\"dd7298aa1a5d2220ba3b11d82db4feb9a3bc908e\"}', '{\"greeting\":\"Welcome\",\"pic\":\"Samuel\",\"server_time\":\"27-09-2019 17:34:46\",\"status\":200,\"status_desc\":\"OK\",\"results\":[]}', '200', '2019-09-27 17:34:46', '[]');
INSERT INTO `api_log` VALUES ('111', 'dd7298aa1a5d2220ba3b11d82db4feb9a3bc908e', '10.5.50.16', '10.5.50.16', '0', 'logPosisi', '{\"signature\":\"dd7298aa1a5d2220ba3b11d82db4feb9a3bc908e\",\"nik\":\"1990\",\"id_tipe_aktifitas\":\"1\",\"lat\":\"-7.953018874782471\",\"long\":\"112.61549592018127\"}', '{\"greeting\":\"Welcome\",\"pic\":\"Samuel\",\"server_time\":\"27-09-2019 17:35:42\",\"status\":200,\"status_desc\":\"OK\",\"results\":[]}', '200', '2019-09-27 17:35:42', '[]');
INSERT INTO `api_log` VALUES ('112', 'dd7298aa1a5d2220ba3b11d82db4feb9a3bc908e', '10.5.50.16', '10.5.50.16', '0', 'listTipeAktifitas', '{\"signature\":\"dd7298aa1a5d2220ba3b11d82db4feb9a3bc908e\"}', '{\"greeting\":\"Welcome\",\"pic\":\"Samuel\",\"server_time\":\"01-10-2019 13:26:09\",\"status\":200,\"status_desc\":\"OK\",\"results\":[{\"id_tipe_aktifitas\":\"1\",\"nama_aktifitas\":\"Masuk Kantor\"},{\"id_tipe_aktifitas\":\"2\",\"nama_aktifitas\":\"Keluar Istirahat\"},{\"id_tipe_aktifitas\":\"3\",\"nama_aktifitas\":\"Masuk Istirahat\"},{\"id_tipe_aktifitas\":\"4\",\"nama_aktifitas\":\"Pulang Kantor\"}]}', '200', '2019-10-01 13:26:09', '[]');
INSERT INTO `api_log` VALUES ('113', 'dd7298aa1a5d2220ba3b11d82db4feb9a3bc908e', '182.0.135.179', '182.0.135.179', '0', 'listTipeAktifitas', '{\"signature\":\"dd7298aa1a5d2220ba3b11d82db4feb9a3bc908e\"}', '{\"greeting\":\"Welcome\",\"pic\":\"Samuel\",\"server_time\":\"20-10-2019 23:15:54\",\"status\":200,\"status_desc\":\"OK\",\"results\":[{\"id_tipe_aktifitas\":\"1\",\"nama_aktifitas\":\"Masuk Kantor\"},{\"id_tipe_aktifitas\":\"2\",\"nama_aktifitas\":\"Keluar Istirahat\"},{\"id_tipe_aktifitas\":\"3\",\"nama_aktifitas\":\"Masuk Istirahat\"},{\"id_tipe_aktifitas\":\"4\",\"nama_aktifitas\":\"Pulang Kantor\"}]}', '200', '2019-10-20 23:15:54', '[]');
INSERT INTO `api_log` VALUES ('114', 'dd7298aa1a5d2220ba3b11d82db4feb9a3bc908e', '36.70.181.56', '36.70.181.56', '0', 'listTipeAktifitas', '{\"signature\":\"dd7298aa1a5d2220ba3b11d82db4feb9a3bc908e\"}', '{\"greeting\":\"Welcome\",\"pic\":\"Samuel\",\"server_time\":\"07-11-2019 14:20:22\",\"status\":200,\"status_desc\":\"OK\",\"results\":[{\"id_tipe_aktifitas\":\"1\",\"nama_aktifitas\":\"Masuk Kantor\"},{\"id_tipe_aktifitas\":\"2\",\"nama_aktifitas\":\"Keluar Istirahat\"},{\"id_tipe_aktifitas\":\"3\",\"nama_aktifitas\":\"Masuk Istirahat\"},{\"id_tipe_aktifitas\":\"4\",\"nama_aktifitas\":\"Pulang Kantor\"}]}', '200', '2019-11-07 14:20:22', '[]');
INSERT INTO `api_log` VALUES ('115', 'dd7298aa1a5d2220ba3b11d82db4feb9a3bc908e', '36.70.181.56', '36.70.181.56', '0', 'loginMarketing', '{\"username\":\"risa\",\"password\":\"123456\",\"signature\":\"dd7298aa1a5d2220ba3b11d82db4feb9a3bc908e\"}', '{\"greeting\":\"Welcome\",\"pic\":\"Samuel\",\"server_time\":\"07-11-2019 14:23:32\",\"status\":200,\"status_desc\":\"OK\",\"results\":{\"success\":\"fail\"}}', '200', '2019-11-07 14:23:32', '[]');
INSERT INTO `api_log` VALUES ('116', 'dd7298aa1a5d2220ba3b11d82db4feb9a3bc908e', '36.70.181.56', '36.70.181.56', '0', 'loginMarketing', '{\"username\":\"admin\",\"password\":\"123456\",\"signature\":\"dd7298aa1a5d2220ba3b11d82db4feb9a3bc908e\"}', '{\"greeting\":\"Welcome\",\"pic\":\"Samuel\",\"server_time\":\"07-11-2019 14:23:38\",\"status\":200,\"status_desc\":\"OK\",\"results\":{\"success\":\"fail\"}}', '200', '2019-11-07 14:23:38', '[]');
INSERT INTO `api_log` VALUES ('117', 'dd7298aa1a5d2220ba3b11d82db4feb9a3bc908e', '180.242.181.210', '180.242.181.210', '0', 'listTipeAktifitas', '{\"signature\":\"dd7298aa1a5d2220ba3b11d82db4feb9a3bc908e\"}', '{\"greeting\":\"Welcome\",\"pic\":\"Samuel\",\"server_time\":\"12-11-2019 10:14:51\",\"status\":200,\"status_desc\":\"OK\",\"results\":[{\"id_tipe_aktifitas\":\"1\",\"nama_aktifitas\":\"Masuk Kantor\"},{\"id_tipe_aktifitas\":\"2\",\"nama_aktifitas\":\"Keluar Istirahat\"},{\"id_tipe_aktifitas\":\"3\",\"nama_aktifitas\":\"Masuk Istirahat\"},{\"id_tipe_aktifitas\":\"4\",\"nama_aktifitas\":\"Pulang Kantor\"}]}', '200', '2019-11-12 10:14:51', '[]');
INSERT INTO `api_log` VALUES ('118', 'dd7298aa1a5d2220ba3b11d82db4feb9a3bc908e', '180.242.181.210', '180.242.181.210', '0', 'loginMarketing', '{\"username\":\"marketing\",\"password\":\"123456\",\"signature\":\"dd7298aa1a5d2220ba3b11d82db4feb9a3bc908e\"}', '{\"greeting\":\"Welcome\",\"pic\":\"Samuel\",\"server_time\":\"12-11-2019 10:15:19\",\"status\":200,\"status_desc\":\"OK\",\"results\":{\"success\":\"OK\",\"profile\":{\"nik\":\"1000001\",\"nama_lengkap\":\"marketing\",\"jnskel\":\"P\",\"nohp\":\"12345678901\",\"username\":\"marketing\",\"password\":\"e10adc3949ba59abbe56e057f20f883e\",\"id_jabatan\":\"3\"}}}', '200', '2019-11-12 10:15:19', '[]');
INSERT INTO `api_log` VALUES ('119', 'dd7298aa1a5d2220ba3b11d82db4feb9a3bc908e', '180.242.181.210', '180.242.181.210', '0', 'Area', '{\"signature\":\"dd7298aa1a5d2220ba3b11d82db4feb9a3bc908e\"}', '{\"greeting\":\"Welcome\",\"pic\":\"Samuel\",\"server_time\":\"12-11-2019 10:15:30\",\"status\":200,\"status_desc\":\"OK\",\"results\":[{\"id_area\":\"1\",\"nama_area\":\"President University\",\"latlong\":\"-6.284646511246752, 107.17045492198395\"},{\"id_area\":\"2\",\"nama_area\":\"Tangerang\",\"latlong\":\"-8.672908854737257, 115.22641240497865\"},{\"id_area\":\"3\",\"nama_area\":\"Jakarta Selatan\",\"latlong\":\"-8.656173924325643, 115.21700083094413\"},{\"id_area\":\"4\",\"nama_area\":\"Jakarta Pusat\",\"latlong\":\"-8.596439868394672, 115.22596068857945\"},{\"id_area\":\"5\",\"nama_area\":\"Jakarta Timur\",\"latlong\":\"-8.674240755149155, 115.20688510393757\"},{\"id_area\":\"6\",\"nama_area\":\"Jakarta Utara\",\"latlong\":\"-6.2846472024006985, 106.74525867290538\"},{\"id_area\":\"9\",\"nama_area\":\"Ocean park BSD City Serpong\",\"latlong\":\"-6.291797044484939, 106.66975568939336\"},{\"id_area\":\"8\",\"nama_area\":\"Jakarta Barat\",\"latlong\":\"-7.953018874782471, 112.61549592018127\"},{\"id_area\":\"11\",\"nama_area\":\"Puri Kembangan\",\"latlong\":\"-6.154640097330813, 106.75906760921498\"},{\"id_area\":\"13\",\"nama_area\":\"Tangerang\",\"latlong\":\"-6.1716662090844565, 106.61668377273338\"},{\"id_area\":\"14\",\"nama_area\":\"depok\",\"latlong\":\"-6.432416277116316, 106.80410099980463\"}]}', '200', '2019-11-12 10:15:30', '[]');
INSERT INTO `api_log` VALUES ('120', 'dd7298aa1a5d2220ba3b11d82db4feb9a3bc908e', '180.242.181.210', '180.242.181.210', '0', 'listTipeAktifitas', '{\"signature\":\"dd7298aa1a5d2220ba3b11d82db4feb9a3bc908e\"}', '{\"greeting\":\"Welcome\",\"pic\":\"Samuel\",\"server_time\":\"12-11-2019 10:17:29\",\"status\":200,\"status_desc\":\"OK\",\"results\":[{\"id_tipe_aktifitas\":\"1\",\"nama_aktifitas\":\"Masuk Kantor\"},{\"id_tipe_aktifitas\":\"2\",\"nama_aktifitas\":\"Keluar Istirahat\"},{\"id_tipe_aktifitas\":\"3\",\"nama_aktifitas\":\"Masuk Istirahat\"},{\"id_tipe_aktifitas\":\"4\",\"nama_aktifitas\":\"Pulang Kantor\"}]}', '200', '2019-11-12 10:17:29', '[]');
INSERT INTO `api_log` VALUES ('121', 'dd7298aa1a5d2220ba3b11d82db4feb9a3bc908e', '180.242.181.210', '180.242.181.210', '0', 'listTipeAktifitas', '{\"signature\":\"dd7298aa1a5d2220ba3b11d82db4feb9a3bc908e\"}', '{\"greeting\":\"Welcome\",\"pic\":\"Samuel\",\"server_time\":\"12-11-2019 10:17:29\",\"status\":200,\"status_desc\":\"OK\",\"results\":[{\"id_tipe_aktifitas\":\"1\",\"nama_aktifitas\":\"Masuk Kantor\"},{\"id_tipe_aktifitas\":\"2\",\"nama_aktifitas\":\"Keluar Istirahat\"},{\"id_tipe_aktifitas\":\"3\",\"nama_aktifitas\":\"Masuk Istirahat\"},{\"id_tipe_aktifitas\":\"4\",\"nama_aktifitas\":\"Pulang Kantor\"}]}', '200', '2019-11-12 10:17:29', '[]');
INSERT INTO `api_log` VALUES ('122', 'dd7298aa1a5d2220ba3b11d82db4feb9a3bc908e', '180.242.181.210', '180.242.181.210', '0', 'listTipeAktifitas', '{\"signature\":\"dd7298aa1a5d2220ba3b11d82db4feb9a3bc908e\"}', '{\"greeting\":\"Welcome\",\"pic\":\"Samuel\",\"server_time\":\"12-11-2019 10:17:42\",\"status\":200,\"status_desc\":\"OK\",\"results\":[{\"id_tipe_aktifitas\":\"1\",\"nama_aktifitas\":\"Masuk Kantor\"},{\"id_tipe_aktifitas\":\"2\",\"nama_aktifitas\":\"Keluar Istirahat\"},{\"id_tipe_aktifitas\":\"3\",\"nama_aktifitas\":\"Masuk Istirahat\"},{\"id_tipe_aktifitas\":\"4\",\"nama_aktifitas\":\"Pulang Kantor\"}]}', '200', '2019-11-12 10:17:42', '[]');
INSERT INTO `api_log` VALUES ('123', 'dd7298aa1a5d2220ba3b11d82db4feb9a3bc908e', '180.242.181.210', '180.242.181.210', '0', 'Area', '{\"signature\":\"dd7298aa1a5d2220ba3b11d82db4feb9a3bc908e\"}', '{\"greeting\":\"Welcome\",\"pic\":\"Samuel\",\"server_time\":\"12-11-2019 10:17:49\",\"status\":200,\"status_desc\":\"OK\",\"results\":[{\"id_area\":\"1\",\"nama_area\":\"President University\",\"latlong\":\"-6.284646511246752, 107.17045492198395\"},{\"id_area\":\"2\",\"nama_area\":\"Tangerang\",\"latlong\":\"-8.672908854737257, 115.22641240497865\"},{\"id_area\":\"3\",\"nama_area\":\"Jakarta Selatan\",\"latlong\":\"-8.656173924325643, 115.21700083094413\"},{\"id_area\":\"4\",\"nama_area\":\"Jakarta Pusat\",\"latlong\":\"-8.596439868394672, 115.22596068857945\"},{\"id_area\":\"5\",\"nama_area\":\"Jakarta Timur\",\"latlong\":\"-8.674240755149155, 115.20688510393757\"},{\"id_area\":\"6\",\"nama_area\":\"Jakarta Utara\",\"latlong\":\"-6.2846472024006985, 106.74525867290538\"},{\"id_area\":\"9\",\"nama_area\":\"Ocean park BSD City Serpong\",\"latlong\":\"-6.291797044484939, 106.66975568939336\"},{\"id_area\":\"8\",\"nama_area\":\"Jakarta Barat\",\"latlong\":\"-7.953018874782471, 112.61549592018127\"},{\"id_area\":\"11\",\"nama_area\":\"Puri Kembangan\",\"latlong\":\"-6.154640097330813, 106.75906760921498\"},{\"id_area\":\"13\",\"nama_area\":\"Tangerang\",\"latlong\":\"-6.1716662090844565, 106.61668377273338\"},{\"id_area\":\"14\",\"nama_area\":\"depok\",\"latlong\":\"-6.432416277116316, 106.80410099980463\"}]}', '200', '2019-11-12 10:17:49', '[]');
INSERT INTO `api_log` VALUES ('124', 'dd7298aa1a5d2220ba3b11d82db4feb9a3bc908e', '180.242.181.210', '180.242.181.210', '0', 'listTipeAktifitas', '{\"signature\":\"dd7298aa1a5d2220ba3b11d82db4feb9a3bc908e\"}', '{\"greeting\":\"Welcome\",\"pic\":\"Samuel\",\"server_time\":\"12-11-2019 10:20:52\",\"status\":200,\"status_desc\":\"OK\",\"results\":[{\"id_tipe_aktifitas\":\"1\",\"nama_aktifitas\":\"Masuk Kantor\"},{\"id_tipe_aktifitas\":\"2\",\"nama_aktifitas\":\"Keluar Istirahat\"},{\"id_tipe_aktifitas\":\"3\",\"nama_aktifitas\":\"Masuk Istirahat\"},{\"id_tipe_aktifitas\":\"4\",\"nama_aktifitas\":\"Pulang Kantor\"}]}', '200', '2019-11-12 10:20:52', '[]');
INSERT INTO `api_log` VALUES ('125', 'dd7298aa1a5d2220ba3b11d82db4feb9a3bc908e', '180.242.181.210', '180.242.181.210', '0', 'logPosisi', '{\"nik\":\"1000001\",\"id_tipe_aktifitas\":\"undefined\",\"lat\":\"\",\"long\":\"\",\"signature\":\"dd7298aa1a5d2220ba3b11d82db4feb9a3bc908e\"}', '{\"greeting\":\"Welcome\",\"pic\":\"Yulia. F <yulia@kpptechnology.co.id>\",\"server_time\":\"12-11-2019 10:20:54\",\"status\":402,\"status_desc\":\"Invalid Parameter\",\"results\":[]}', '402', '2019-11-12 10:20:54', '[\"lat\",\"long\"]');
INSERT INTO `api_log` VALUES ('126', 'dd7298aa1a5d2220ba3b11d82db4feb9a3bc908e', '180.242.181.210', '180.242.181.210', '0', 'Area', '{\"signature\":\"dd7298aa1a5d2220ba3b11d82db4feb9a3bc908e\"}', '{\"greeting\":\"Welcome\",\"pic\":\"Samuel\",\"server_time\":\"12-11-2019 10:20:59\",\"status\":200,\"status_desc\":\"OK\",\"results\":[{\"id_area\":\"1\",\"nama_area\":\"President University\",\"latlong\":\"-6.284646511246752, 107.17045492198395\"},{\"id_area\":\"2\",\"nama_area\":\"Tangerang\",\"latlong\":\"-8.672908854737257, 115.22641240497865\"},{\"id_area\":\"3\",\"nama_area\":\"Jakarta Selatan\",\"latlong\":\"-8.656173924325643, 115.21700083094413\"},{\"id_area\":\"4\",\"nama_area\":\"Jakarta Pusat\",\"latlong\":\"-8.596439868394672, 115.22596068857945\"},{\"id_area\":\"5\",\"nama_area\":\"Jakarta Timur\",\"latlong\":\"-8.674240755149155, 115.20688510393757\"},{\"id_area\":\"6\",\"nama_area\":\"Jakarta Utara\",\"latlong\":\"-6.2846472024006985, 106.74525867290538\"},{\"id_area\":\"9\",\"nama_area\":\"Ocean park BSD City Serpong\",\"latlong\":\"-6.291797044484939, 106.66975568939336\"},{\"id_area\":\"8\",\"nama_area\":\"Jakarta Barat\",\"latlong\":\"-7.953018874782471, 112.61549592018127\"},{\"id_area\":\"11\",\"nama_area\":\"Puri Kembangan\",\"latlong\":\"-6.154640097330813, 106.75906760921498\"},{\"id_area\":\"13\",\"nama_area\":\"Tangerang\",\"latlong\":\"-6.1716662090844565, 106.61668377273338\"},{\"id_area\":\"14\",\"nama_area\":\"depok\",\"latlong\":\"-6.432416277116316, 106.80410099980463\"}]}', '200', '2019-11-12 10:20:59', '[]');
INSERT INTO `api_log` VALUES ('127', 'dd7298aa1a5d2220ba3b11d82db4feb9a3bc908e', '114.5.210.82', '114.5.210.82', '0', 'listTipeAktifitas', '{\"signature\":\"dd7298aa1a5d2220ba3b11d82db4feb9a3bc908e\"}', '{\"greeting\":\"Welcome\",\"pic\":\"Samuel\",\"server_time\":\"21-11-2019 14:21:40\",\"status\":200,\"status_desc\":\"OK\",\"results\":[{\"id_tipe_aktifitas\":\"1\",\"nama_aktifitas\":\"Masuk Kantor\"},{\"id_tipe_aktifitas\":\"2\",\"nama_aktifitas\":\"Keluar Istirahat\"},{\"id_tipe_aktifitas\":\"3\",\"nama_aktifitas\":\"Masuk Istirahat\"},{\"id_tipe_aktifitas\":\"4\",\"nama_aktifitas\":\"Pulang Kantor\"}]}', '200', '2019-11-21 14:21:40', '[]');
INSERT INTO `api_log` VALUES ('128', 'dd7298aa1a5d2220ba3b11d82db4feb9a3bc908e', '114.5.210.82', '114.5.210.82', '0', 'loginMarketing', '{\"username\":\"tes\",\"password\":\"123456\",\"signature\":\"dd7298aa1a5d2220ba3b11d82db4feb9a3bc908e\"}', '{\"greeting\":\"Welcome\",\"pic\":\"Samuel\",\"server_time\":\"21-11-2019 14:22:43\",\"status\":200,\"status_desc\":\"OK\",\"results\":{\"success\":\"fail\"}}', '200', '2019-11-21 14:22:43', '[]');
INSERT INTO `api_log` VALUES ('129', 'dd7298aa1a5d2220ba3b11d82db4feb9a3bc908e', '114.5.210.82', '114.5.210.82', '0', 'loginMarketing', '{\"username\":\"aziz\",\"password\":\"123456\",\"signature\":\"dd7298aa1a5d2220ba3b11d82db4feb9a3bc908e\"}', '{\"greeting\":\"Welcome\",\"pic\":\"Samuel\",\"server_time\":\"21-11-2019 14:23:00\",\"status\":200,\"status_desc\":\"OK\",\"results\":{\"success\":\"OK\",\"profile\":{\"nik\":\"120801\",\"nama_lengkap\":\"abdul aziz\",\"jnskel\":\"L\",\"nohp\":\"1234564\",\"username\":\"aziz\",\"password\":\"e10adc3949ba59abbe56e057f20f883e\",\"id_jabatan\":\"3\"}}}', '200', '2019-11-21 14:23:00', '[]');
INSERT INTO `api_log` VALUES ('130', 'dd7298aa1a5d2220ba3b11d82db4feb9a3bc908e', '114.5.210.82', '114.5.210.82', '0', 'Area', '{\"signature\":\"dd7298aa1a5d2220ba3b11d82db4feb9a3bc908e\"}', '{\"greeting\":\"Welcome\",\"pic\":\"Samuel\",\"server_time\":\"21-11-2019 14:23:24\",\"status\":200,\"status_desc\":\"OK\",\"results\":[{\"id_area\":\"1\",\"nama_area\":\"President University\",\"latlong\":\"-6.284646511246752, 107.17045492198395\"},{\"id_area\":\"2\",\"nama_area\":\"Tangerang\",\"latlong\":\"-8.672908854737257, 115.22641240497865\"},{\"id_area\":\"3\",\"nama_area\":\"Jakarta Selatan\",\"latlong\":\"-8.656173924325643, 115.21700083094413\"},{\"id_area\":\"4\",\"nama_area\":\"Jakarta Pusat\",\"latlong\":\"-8.596439868394672, 115.22596068857945\"},{\"id_area\":\"5\",\"nama_area\":\"Jakarta Timur\",\"latlong\":\"-8.674240755149155, 115.20688510393757\"},{\"id_area\":\"6\",\"nama_area\":\"Jakarta Utara\",\"latlong\":\"-6.2846472024006985, 106.74525867290538\"},{\"id_area\":\"9\",\"nama_area\":\"Ocean park BSD City Serpong\",\"latlong\":\"-6.291797044484939, 106.66975568939336\"},{\"id_area\":\"8\",\"nama_area\":\"Jakarta Barat\",\"latlong\":\"-7.953018874782471, 112.61549592018127\"},{\"id_area\":\"11\",\"nama_area\":\"Puri Kembangan\",\"latlong\":\"-6.154640097330813, 106.75906760921498\"},{\"id_area\":\"13\",\"nama_area\":\"Tangerang\",\"latlong\":\"-6.1716662090844565, 106.61668377273338\"},{\"id_area\":\"14\",\"nama_area\":\"depok\",\"latlong\":\"-6.432416277116316, 106.80410099980463\"}]}', '200', '2019-11-21 14:23:24', '[]');
INSERT INTO `api_log` VALUES ('131', 'dd7298aa1a5d2220ba3b11d82db4feb9a3bc908e', '10.5.50.5', '10.5.50.5', '0', 'listTipeAktifitas', '{\"signature\":\"dd7298aa1a5d2220ba3b11d82db4feb9a3bc908e\"}', '{\"greeting\":\"Welcome\",\"pic\":\"Samuel\",\"server_time\":\"21-11-2019 14:36:21\",\"status\":200,\"status_desc\":\"OK\",\"results\":[{\"id_tipe_aktifitas\":\"1\",\"nama_aktifitas\":\"Masuk Kantor\"},{\"id_tipe_aktifitas\":\"2\",\"nama_aktifitas\":\"Keluar Istirahat\"},{\"id_tipe_aktifitas\":\"3\",\"nama_aktifitas\":\"Masuk Istirahat\"},{\"id_tipe_aktifitas\":\"4\",\"nama_aktifitas\":\"Pulang Kantor\"}]}', '200', '2019-11-21 14:36:21', '[]');
INSERT INTO `api_log` VALUES ('132', 'dd7298aa1a5d2220ba3b11d82db4feb9a3bc908e', '10.5.50.5', '10.5.50.5', '0', 'logPosisi', '{\"nik\":\"1000001\",\"id_tipe_aktifitas\":\"1\",\"lat\":\"-6.4723094\",\"long\":\"106.8662156\",\"signature\":\"dd7298aa1a5d2220ba3b11d82db4feb9a3bc908e\"}', '{\"greeting\":\"Welcome\",\"pic\":\"Samuel\",\"server_time\":\"21-11-2019 14:36:25\",\"status\":200,\"status_desc\":\"OK\",\"results\":[]}', '200', '2019-11-21 14:36:25', '[]');
INSERT INTO `api_log` VALUES ('133', 'dd7298aa1a5d2220ba3b11d82db4feb9a3bc908e', '10.5.50.5', '10.5.50.5', '0', 'Area', '{\"signature\":\"dd7298aa1a5d2220ba3b11d82db4feb9a3bc908e\"}', '{\"greeting\":\"Welcome\",\"pic\":\"Samuel\",\"server_time\":\"21-11-2019 14:36:34\",\"status\":200,\"status_desc\":\"OK\",\"results\":[{\"id_area\":\"1\",\"nama_area\":\"President University\",\"latlong\":\"-6.284646511246752, 107.17045492198395\"},{\"id_area\":\"2\",\"nama_area\":\"Tangerang\",\"latlong\":\"-8.672908854737257, 115.22641240497865\"},{\"id_area\":\"3\",\"nama_area\":\"Jakarta Selatan\",\"latlong\":\"-8.656173924325643, 115.21700083094413\"},{\"id_area\":\"4\",\"nama_area\":\"Jakarta Pusat\",\"latlong\":\"-8.596439868394672, 115.22596068857945\"},{\"id_area\":\"5\",\"nama_area\":\"Jakarta Timur\",\"latlong\":\"-8.674240755149155, 115.20688510393757\"},{\"id_area\":\"6\",\"nama_area\":\"Jakarta Utara\",\"latlong\":\"-6.2846472024006985, 106.74525867290538\"},{\"id_area\":\"9\",\"nama_area\":\"Ocean park BSD City Serpong\",\"latlong\":\"-6.291797044484939, 106.66975568939336\"},{\"id_area\":\"8\",\"nama_area\":\"Jakarta Barat\",\"latlong\":\"-7.953018874782471, 112.61549592018127\"},{\"id_area\":\"11\",\"nama_area\":\"Puri Kembangan\",\"latlong\":\"-6.154640097330813, 106.75906760921498\"},{\"id_area\":\"13\",\"nama_area\":\"Tangerang\",\"latlong\":\"-6.1716662090844565, 106.61668377273338\"},{\"id_area\":\"14\",\"nama_area\":\"depok\",\"latlong\":\"-6.432416277116316, 106.80410099980463\"}]}', '200', '2019-11-21 14:36:34', '[]');
INSERT INTO `api_log` VALUES ('134', 'dd7298aa1a5d2220ba3b11d82db4feb9a3bc908e', '180.244.234.3', '180.244.234.3', '0', 'listTipeAktifitas', '{\"signature\":\"dd7298aa1a5d2220ba3b11d82db4feb9a3bc908e\"}', '{\"greeting\":\"Welcome\",\"pic\":\"Samuel\",\"server_time\":\"18-12-2019 21:30:38\",\"status\":200,\"status_desc\":\"OK\",\"results\":[{\"id_tipe_aktifitas\":\"1\",\"nama_aktifitas\":\"Masuk Kantor\"},{\"id_tipe_aktifitas\":\"2\",\"nama_aktifitas\":\"Keluar Istirahat\"},{\"id_tipe_aktifitas\":\"3\",\"nama_aktifitas\":\"Masuk Istirahat\"},{\"id_tipe_aktifitas\":\"4\",\"nama_aktifitas\":\"Pulang Kantor\"}]}', '200', '2019-12-18 21:30:38', '[]');
